store_name,contact_number,address,city
"Stone House :- Best Granite, Sandstone & Marble in Jaipur | CNC Jaali | Stone Mural | Stone Wall Pannel | Sandstone Jaali",08058829492,"26,Kalwar Road, Surjeet Nagar,Jhotwara Near 200 ft Kalwar Road Byepass,Jhotwada, opposite SaniDev Mandir, Jaipur, Rajasthan 302012",Jaipur
SHRI TIRUPATI GRANITE,09649910111,"Ajmer Rd, near 200 Feet Bypass Road, opposite SHIKHER DENTAL HOSPITAL, Rani Sati Nagar, Nirman Nagar, Tagore Nagar, Jaipur, Rajasthan 302021",Jaipur
GRANITE WORLD - Granite Dealers,09929869511,"Plot No. 1, Chitrakoot Marg, Ajmer Rd, near Hotel Kiran Palace, Tagore Nagar, Jaipur, Rajasthan 302021",Jaipur
Oswal marble & Granite (OMG),09828152255,"New Sanganer Rd, near Jain and choudhary dharm kata, Shiv Parwati Nagar, Geetanjali Colony, Mohru Nagar, Mansarovar, Jaipur, Rajasthan 302020",Jaipur
Deepika marble & granite,07878568188,"B-5, Vigyan Nagar, Jagatpura, Jaipur, Rajasthan 302017",Jaipur
PAHARIYA STONES,08290088889,"Plot No. 21, Gopalpura Bypass Rd, opp. Metro Pillar 19, near Mansarovar Metro Station, Nirman Nagar, Ranisati Nagar, Jaipur, Rajasthan 302020",Jaipur
Vyas Marbles,09829013230,"Gokulpura - Kalwar Rd, Gokulpura, Jaipur, Rajasthan 302012",Jaipur
Welcome Granite & Marbles,09414018888,"Ajmer Road, Opposite Shyam Nagar, Mod, Sodala, Jaipur, Rajasthan 302006",Jaipur
Glorious Granite : Marble and granite supplier in jaipur,08432387777,"78 ,DCM, Ajmer Rd, Heera Nagar, Tagore Nagar, Jaipur, Rajasthan 302021",Jaipur
Hitesh Granite & Stones,09571516204,"NRI Colony Rd, Ramnagariya, Jaipur, Rajasthan 303012",Jaipur
PAHARIYA STONES | Imported Marble in Jaipur | Granite | Quartz | Premium Stones,08290088885,"Metro Station, 20, Gopalpura Bypass Rd, opposite Pillar No. 18, Nirman Nagar, Mansarovar, Jaipur, Rajasthan 302020",Jaipur
K.K STONE,08290963938,"Chandra Villa' B-182 Bank officers Campus, Jagatpura, Ramnagariya, Jaipur, Rajasthan 302017",Jaipur
UNIQUE STONEX INDIA.,09887678787,"B, 2, Gopalpura Bypass Rd, Dr. Rajendra Prasad Nagar-A, Manyawas, Mohru Nagar, Mansarovar, Jaipur, Rajasthan 302019",Jaipur
Shree Balaji marble and granite,08290315308,"Sukh Vihar, 41, Gurjar Ki Thadi, Jaipur, Rajasthan 302019",Jaipur
Dreamax Marble Center Jaipur,09001647120,"Shiv Mandir, Opp: Vedanta Hospital, Ajmer Rd, Rani Sati Nagar, Nirman Nagar, Brijlalpura, Jaipur, Rajasthan 302006",Jaipur
Gravity Stones,09672027524,"Metro Station, opposite Pillar No:- 26, Nirman Nagar, Mansarovar, Jaipur, Rajasthan 302019",Jaipur
Granite & Stone hub,09004253224,"D-40 Central Spine Jirota Opp. Bombay Hospital, Near Apparel Park, Jagatpura, Jaipur, Rajasthan 302017",Jaipur
Kale Khan Chhajju Khan Stone Merchant,09929888887,"E-19, Madhuvan Colony, Barkat Nagar, Tonk Phatak, Jaipur, Rajasthan 302015",Jaipur
Prakash Marbles,09928010921,"Plot No.98,Lajpat Nagar, Mahal Rd, Braj Puri, Vidhyadhar Nagar, Sin Ka Barah, Jagatpura, Jaipur, Rajasthan 302017",Jaipur
Granite Palace,08619989282,"Hans Vihar, Plot no. 98, Vande Mataram Marg, near family hospital and front of indian petrol pump, Manyawas, Mansarovar, Jaipur, Rajasthan 302020",Jaipur
Balaji Tiles & Granite - Best Tiles and Granite Supplier in Jaipur,08209743802,"Rajasthan Girls Collage, Charan Nadi 2nd, Kaishav Nagar, Jaipur, Rajasthan 302039",Jaipur
Jaipur Tiles,09694317171,"Kalwar, Rajasthan 302044",Jaipur
SHIVMAHIMA TILES AND GRANITES,09785662244,"116, Mod, opp. Indian Oil Petrol Pump, near Aurobindo School, Sirsi, Jaipur, Rajasthan 302012",Jaipur
Swastik Stones (Granite stone showroom),09314510275,"B-18, Govind Marg, Adarsh Nagar, Jaipur, Rajasthan 302004",Jaipur
Gupta Marble and granites,09414022886,"287, Ajmer Rd, Heera Nagar, Tagore Nagar, Jaipur, Rajasthan 302021",Jaipur
Kanika marbles Granite and Tile,09414888213,"Gokulpura , kalwar road , jhotwara Gokulpura road, Kalwar Rd, Jaipur, Rajasthan 302012",Jaipur
Shree Avtar Marbles & Granite - Best Marbles and granite in Jaipur,09314429397,"E-210, Rd Number 6, Vishwakarma Industrial Area, Jaipur, Rajasthan 302013",Jaipur
MANGALAM GRANITE,08302458226,"257, Dalda Factory Rd, Mahaveer Nagar 2, Maharani Farm, Gayatri Nagar B, Durgapura, Jaipur, Rajasthan 302018",Jaipur
Kajaria Tiles Authorised Showroom - Jaipur Tiles & Granite,09694317171,"HP Petrol Pump, Jhotwara Rd, Gokulpura, Hathod, Jaipur, Rajasthan 302012",Jaipur
Gwalior Stones,08440909966,"23,24, Kalwar Rd, Suraj Nagar, Jhotwara, Jaipur, Rajasthan 302012",Jaipur
Dhoot Imported Marble,09829063114,"DCM, Ajmer Rd, Heera Nagar, Tagore Nagar, Jaipur, Rajasthan 302021",Jaipur
Laxmi Marble & Granites.,09413324121,"Shop No.27, 28, Meena Wala -Sirsi Rd, Panchyawala, Jaipur, Rajasthan 302034",Jaipur
Shri Krishna Tiles granite and chemicals,09079651423,"pillar number 16, Mansarovar metro station, Shop number 4, Jaipur, Rajasthan 302020",Jaipur
Shree Balaji traders In Jaipur,08000021353,"Sirsi Rd, near Ganga Devi filing station, Jaipur, Rajasthan 302012",Jaipur
Coral Quartz,07300069242,"F-78 A, Rd Number 5, behind Cks Hospital, Vishwakarma Industrial Area, Jaipur, Rajasthan 302013",Jaipur
SHIVA TILES & Granite,09799365865,"Ground Floor, Shree Vinayak Plaza, Plot no 6, Badarwas Road, Manyawas, Mohru Nagar, Mansarovar, Jaipur, Rajasthan 302019",Jaipur
Jaipur Stone Pebble (White Black Colored Wholesale),07340561155,"B3, Bhan Nagar, Basement, Queens Rd, Vaishali Nagar, Jaipur, Rajasthan 302021",Jaipur
Shri Balaji Marbles,09783188266,"New Sanganer Rd, Ward 27, Mansarovar Sector 6, Mansarovar, Jaipur, Rajasthan 302020",Jaipur
Marble Udhyog,09414073597,"Govind Marg, Saket Colony, Adarsh Nagar, Jaipur, Rajasthan 302004",Jaipur
Pareek Stonex Marble & Granite,09829173551,"Police Station, C-353, Kings Rd, near shyam Nagar, Nirman Nagar, Ranisati Nagar, Jaipur, Rajasthan 302020",Jaipur
AMAC Stones,08209113728,"Shyam Sarovar Colony, 100 Ft. Road, Gopalpura Bypass Rd, near Rana Granite & Marbles, Gajsinghpur, Jaipur, Rajasthan 302020",Jaipur
Digvijay Marble,08560800951,"A 168 Surjeet Nagar, Patrol Pump K Pass, Kalwar Road Jaipur, Jaipur, Rajasthan 302012",Jaipur
Shree Shyam Marble,07878855829,"Pandit Ji Ka Farm, New Sanganer Rd, opposite Sparsh Hospital, near Oxford International Public School, Sanganer, Jaipur, Rajasthan 302029",Jaipur
Neelmani Tiles & Granite,07877702774,"Metro Pillar No 23, Metro Station Mansarovar, Opposite, Gopalpura Bypass Rd, Mansarovar Sector 1, Mansarovar, Jaipur, Rajasthan 302020",Jaipur
The Stone & Tile Studio,09928346608,"149 B, Vidhansabha Nagar, Mansarovar, Jaipur, Rajasthan 302020",Jaipur
Mahalaxmi Granite,09887022470,"A23, VIT Rd, Swaroop Vihar, Jagatpura, Jaipur, Rajasthan 302017",Jaipur
Chhagan Contractor - Tile Marble & Granite Fitting in Jaipur,09887341280,"New Sanganer Rd, Ambeshwar Colony, Shiv Puri Colony, Sodala, Jaipur, Rajasthan 302019",Jaipur
"Chhagan Contractor - Tile Marble & Granite Fitting Near by Jagatpura, Jaipur",07378179146,"Jagatpura, Jaipur, Rajasthan 302017",Jaipur
Walker Inc (Shreeji granite marble and tiles)),09116645013,"Dhan bag merrage garden ke pas sitawali fhatak, dhan bag marriage gardan, 100 feet, Benad Rd, Rajasthan 302012",Jaipur
Jai Marbles - Pavit Tiles Dealer and Distributors,09828021798,"B/58, Anita Colony, Bajaj Nagar, Jaipur, Rajasthan 302015",Jaipur
AGARWAL ROCKS LLP,09166770023,"308, Sector 8, Vidyadhar Nagar, Jaipur, Rajasthan 302039",Jaipur
M R G Marbles,07073202805,"Unnamed Road, Harnathapura, Jhotwara, Jaipur, Rajasthan 302012",Jaipur
Sri vinayaka marbles & granites,08618210837,"Marble mandi, Mahal Rd, opposite akshay patra, Jagatpura, Jaipur, Rajasthan 302017",Jaipur
Kavita Marble,09414012495,"Krishi Vihar, Manyawas, Mohru Nagar, • मान्यावास, Manyawas, Manyawas, Mangyaw, Jaipur, Rajasthan 302020",Jaipur
Jogeshwar Marbles,09413837910,"RQX7+4GJ, New Sanganer Rd, Opposite Vijay Path, Mansarovar, Jaipur, Rajasthan 302020",Jaipur
Kajaria Tiles Authorised Showroom - S.K. Agarwal & Co,09928035182,"S.K. Agarwal & Co 95, New Aatish Market, Mansarovar, Jaipur, Rajasthan 302020",Jaipur
JAI JAMUWAY MATA MARBLES,08109741247,"RFC ENCLAVE, Plot no. C10, VIT Rd, near 7 NIGHTS HOTEL, Jagatpura, Jaipur, Rajasthan 302017",Jaipur
Shree Vinayak UPVC And Granite Jitendra kumawat,08385950576,"200 Feet Bypass Rd, Yadav Nagar, Jamunapuri, Murlipura, Jaipur, Rajasthan 302039",Jaipur
NITCO Tile Jaipur,07340400888,"Buildfloor, N-208, New Aatish Market, Mansarovar, Jaipur, Rajasthan 302020",Jaipur
Divine Homes / Best Tiles/ Sanitaryware/ Bathroom Accessories in Jaipur,08209084727,"G-34, Bharat Mata Cir, Manyawas, Mansarovar, Jaipur, Rajasthan 302020",Jaipur
Name plates nd Marbel moortis,09783879594,"bhola braman ki gali, 2461, Bhindo ka Rasta, Chandpole Bazar, Chandpole, Pink City, Jaipur, Rajasthan 302001",Jaipur
Kota Stone Supplier,09929888887,"E-19, Tonk Rd, opp. sayyat ka gatta, Madhuvan Colony, Barkat Nagar, Tonk Phatak, Jaipur, Rajasthan 302015",Jaipur
Shri Balaji Granite,09887381970,"Plot No. 6-A, Chankyapuri-1, Mahal Rd, Jagatpura, Jaipur, Rajasthan",Jaipur
Ganpati Tiles,08619874182,"Opposite Jain Dental Clinic,Choudhary Petrol Pump, Jaipur, Rajasthan 302029",Jaipur
Stone Land,01412230637,"Alankar Plaza, T-25, Sector 2, Central Spine, Vidyadhar Nagar, Jaipur, Rajasthan 302039",Jaipur
The Tile Studio,09717407153,"plot 1 Mahal Road, NRI Cir, near Mathura Misthan, Vishwa Vidhyalaya Nagar, Jagatpura, Jaipur, Rajasthan 302017",Jaipur
"House of Johnson - Saraswati Sanitary - Best Tiles Designs for Bathroom, Kitchen, Wall & Floor in Jaipur",08037761315,"Shop No 130, Near Gurjar ki Khadi, opp. Bhomia Mandir, New Aatish Market, Mansarovar, Jaipur, Rajasthan 302020",Jaipur
Silk tiles,09001586327,"Shri shyam srover gajsinghpura gopalpura bypass road, 100 Feet Main Rd, near by kk granite, Jaipur, Rajasthan 302020",Jaipur
"Sandstones, Granite and Marble in Jaipur - Shree Ganesh Stones",09414278923,"F 117/118 Extension 2nd Bagru Industrial Area Ajmer, Road, Bagru, Rajasthan 303007",Jaipur
AGARSEN GRANITE AND STONES,09950144571,"476, Shanti Nagar, Mahaveer Nagar, Durgapura, Jaipur, Rajasthan 302018",Jaipur
DHARTI CRAFT (Granite & Marble India),09414077044,"B-3 (Ground Floor, Queens Rd, Vidyut Nagar B, Bhan Nagar, Jaipur, Rajasthan 302021",Jaipur
Shuru Stones LLP,01412982111,"RH6G+Q66, RIICO Industrial Area Bagru, Phase II EXTN, Jaipur, Rajasthan 303007",Jaipur
Jai Shree Granite & Marbles,08385877582,"B-1, Gopalpura Bypass Rd, Dr. Rajendra Prasad Nagar-A, Manyawas, Mohru Nagar, Mansarovar, Jaipur, Rajasthan 302019",Jaipur
Kale Khan Chajju Khan All Type Of Stone Available,07014917278,"auric motors, VT Rd, near hotel royal bagh, opposite maruti suzuki arena, Ward 27, Mansarovar, Jaipur, Rajasthan 302020",Jaipur
Estilo - Style Matters,08963003000,"B-1,2,Krashi Vihar, Behind Natani Marble, Gopal Pura, B6-11, 200 Feet Bypass Rd, Krishi Vihar, Manyawas, Mohru Nagar, Jaipur, Rajasthan 302020",Jaipur
Universal House,08094450777,"C-7 Hanuman Nagar, Hanuman Nagar, Vaishali Nagar, Jaipur, Rajasthan 302021",Jaipur
Stellar Stones : KOHLER Authorized & QUTONE Tiles Exclusive Showroom,09660003111,"Tarkeshwar Sarovar, 76, Vande Mataram Marg, behind Family Hospital, Manyawas, Jaipur, Rajasthan 302020",Jaipur
Jodhpur Stone Company,07069995432,"B-12,Bani Park, Jhotwara Road, Shiv Marg, Kanti Nagar, Sindhi Camp, Jaipur, Rajasthan 302016",Jaipur
Galaxy Impex,01412521844,"Pradhan Marg, Mauji Colony, Gem Enclave, Malviya Nagar, Jaipur, Rajasthan 302017",Jaipur
Kasera marbles & granites,09829014010,"H-160, BADHARNA marble Mandi, Rd Number 14, Vishwakarma Industrial Area, Jaipur, Rajasthan 302013",Jaipur
Ganpati Stone art,09982672677,"301/129, Lions line, Sirsi Rd, Vaishali Nagar, Jaipur, Rajasthan 302012",Jaipur
Stone Oasis,09828585558,"414-415, Vijai, VJ City Point, Ahinsa Cir, C Scheme, Ashok Nagar, Jaipur, Rajasthan 302001",Jaipur
Dholpur Karoli Stones,09829200738,"Shop no 33-34 Tagore Nagar, near shikhar dental hospital 200 ft byepass, Ajmer Rd, Jaipur, Rajasthan 302019",Jaipur
Ghodela Stone & Sanitary,09829255782,"Plot No 18, Apna Aagan Yojna, New Loha Mandi Road, Road No 14 Sikar Road, road, New Loha Mandi, Jaipur, Rajasthan 302013",Jaipur
MAHI Exim world,09672507879,"37, Sanjay Nagar, Jagannath Puri, Suraj Nagar, Jhotwara, Jaipur, Rajasthan 302012",Jaipur
SHREE RAM IMPEX,01316912591,"Plot No. 13 , F-1, FF, Shiv Shankar Nagar, Chak, Gatore, Sanganer, Jaipur, Rajasthan 302033",Jaipur
"Vibha Smart Stone - Best Tile Shop | Varmora Tiles, Bathroom Tiles & Home Improvement Experts",09829300043,"Rathi Nagar, 142,Gajsinghpura, Gopalpura by Pass Road, near Evergreen Palace, Manyawas, Mode, Jaipur, Rajasthan 302021",Jaipur
DSC Stone Tech,08003031333,"Sunny Mart, G-33 & 34, New Aatish Market, Mansarovar Sector 3, Jaipur, Rajasthan 302020",Jaipur
The Tiles World,09982820000,"shop no.34, Gangaram Nagar, New Aatish Market, Shanthi Nagar, Mansarovar, Jaipur, Rajasthan 302020",Jaipur
Bhagwan & Company,09602817166,"15, Royal Nagar,, Tonk Rd, opp. Satnam Honda, Jaipur, Rajasthan 302018",Jaipur
Akash Tiles,08648888875,"43, Benad Rd, near mohan hospital, Shyam Nagar, Nangal Jaisabohra, Jaipur, Rajasthan 302012",Jaipur
Maheshwari Tiles & sanitary,08559969790,"New Sanganer Rd, Geetanjali Colony, Mohru Nagar, Mansarovar, Jaipur, Rajasthan 302020",Jaipur
India Stone House LLP,01412616868,"311, Sindhi Colony, Shanti Path, Raja Park, Jaipur, Rajasthan 302004",Jaipur
Shri Natani Marbles,01412595698,"VQFW+JWR, Madhuban Colony Road, Jawahar Nagar, Madhuvan Colony, Shanti Niketan Colony, Tonk Phatak, Jaipur, Rajasthan 302015",Jaipur
Salasar Marble and Granite,07376088888,"Plot No: 64 Nagaur Nagar Teja Circle Opp: Metro Pillar No 1 Mansarover Metro Station, Jaipur, Rajasthan 302020",Jaipur
Maheshwari Marble And Granite,09251073144,"kirti sagar vistar A block, Vande Mataram Marg, Manyawas, Jaipur, Rajasthan 302020",Jaipur
"B S Construction & Stone (Marble, Granite) Supplier",09950376350,"233 vastunager, Narayan Vihar, Jaipur, Rajasthan 302021",Jaipur
Jagannath marble and Granite,07976284593,"Hotel Hayat ke pass, Muhana Mandi Rd, Kalyanpura, Mansarovar, Jaipur, Rajasthan 302020",Jaipur
Shree rana marble and granite,09414484627,"Shri shyam srover gajsinghpura gopalpura bypass road, 100 Feet Main Rd, Jaipur, Rajasthan 302020",Jaipur
Shri bhikshu marbles and granite,09314050870,"Vishwakarma Industrial Area, Jaipur, Rajasthan 302013",Jaipur
SHREE HARI GRANITE & STONES,07726996666,"Unnamed Road, Karolan Ka Barh, Jaipur, Rajasthan 303012",Jaipur
Natural Stone Depot Group,09799999087,"IInd Floor, Bharat Apartment, S-2, Gandhi Path Rd, West, Vaishali Nagar, Jaipur, Rajasthan 302021",Jaipur
Tirupati Stonex,07976250412,"Tirupati Granite, Mahal road, Jagatpura, Jaipur, Rajasthan 302017",Jaipur
Royal Soni Marble And Granite,09929099978,"F 35-A , badarna, Road No. 14, Industrial Area, Jaipur, Rajasthan 302013",Jaipur
Kanika Granitex,09829049833,"15,16, Jaitram Nagar, B-14, Mansarover, Mansarovar, Jaipur, Rajasthan 302020",Jaipur
Makrana marble and granite,07300379448,"dukya petrol pump, R C, Sanganer, Jaipur, Rajasthan 302029",Jaipur
Taluka granite,09829130863,"DCM , ajmer road, Brijlalpura, Jaipur, Rajasthan 302019",Jaipur
ISHA Stones,07737759831,"10, Sirsi Rd, Hanuman Nagar Extension, Paschim Vihar, Vaishali Nagar, Jaipur, Rajasthan 302021",Jaipur
RSG Stones,09783900000,"Ajmer-Jaipur Expy, next to Mahindra Tractors, Mahlan, Rajasthan 303007",Jaipur
M R K Granite Depot,09461178807,"Harnathapura, Jhotwara, Jaipur, Rajasthan 302012",Jaipur
Stone Park,09414056560,"Shree Shyam Marble & Granite,34 Main Sms Colony,Near Vijaypath Agarw, Shipra Path, Jaipur, Rajasthan 302020",Jaipur
Bhavesh Granites,09782474397,"Gurjaro ki Talai, Diggi Malpura Road, Mod, Sanganer, Muhana, Jaipur, Rajasthan 302029",Jaipur
Techno Hind Marble And Granites,09414047308,"D -193A, Rd Number - 1D, opposite HDFC Bank, Vishwakarma Industrial Area, Jaipur, Rajasthan 302039",Jaipur
SHIVA STONES,08619118590,"Vandemateram road, 200, foot road, Jaipur, Rajasthan 302020",Jaipur
Anmol Granites,09829024313,"7&8, Asha Vihar, Road, Ajmer Rd, next to Om Sweets, Nirman Nagar, Jaipur, Rajasthan 302019",Jaipur
Abhee Granite & Stones,08000884838,"C-127, Moti Marg, Bapu Nagar, Jaipur, Rajasthan 302018",Jaipur
Garima Marble & Granite Supplier,08005857482,"NRI Colony Rd, Sector 26, Jagatpura, Jaipur, Rajasthan 302017",Jaipur
Kalingastone Quartz Jaipur,09116005234,"F-78 A, Rd Number 5, Vishwakarma Industrial Area, Jaipur, Rajasthan 302013",Jaipur
Shivaay Granites,09251422119,"Plot no 41, Gopalpura Bypass Rd, Badarwas, Manyawas, Govind Nagar, Jaipur, Rajasthan 302019",Jaipur
SDM MARBLE & GRANITE,09414840694,"XM5G+3P9, Jaipur, Rajasthan 302044",Jaipur
"Golden Granites - Deals in all kind of Granites, Stones & Imported Marbles",09769065077,"Rajput marble market, Plot No 27-A, Marve Rd, Malad, Kharodi Village, Malad West, Mumbai, Maharashtra 400095",Mumbai
Mount Granite,09821040982,"B-1, Amar Estate, Cross Rd B, opposite Packing Paper Industry, M.I.D.C, Bhim Nagar, Andheri East, Mumbai, Maharashtra 400059",Mumbai
"Vijay Marble And Granites || Agl Composite, Johnson, Kalinga quartz, Nirali sink, Carysil sink",07021094476,"Plot no. 9a, opp. Poonam Darshan Building, MMRDA Colony, Poonam Nagar, Jogeshwari East, Mumbai, Maharashtra 400093",Mumbai
Mahadev Granites,09769723239,"Airport Site, Western Express Highway, Service Rd, Subhash Nagar, Vile Parle East, Airport, Mumbai, Maharashtra 400099",Mumbai
"Aadi Granites - Granite Supplier, Granite Dealer , Granite Distributor, Marble Supplier & Marble Dealer",09773414229,"2, Lal Bahadur Shastri Marg, Vrindavan, Chunabhatti, Sion, Mumbai, Maharashtra 400070",Mumbai
Mewar Marbles,09819172696,"Shop No.4, Behind Maharashtra Weight Bridge, Kurla(W, Lal Bahadur Shastri Marg, Sion, Mumbai, Maharashtra 400070",Mumbai
Janata Lime Trading Co.,09833748186,"Marble and Tile Shop, 601, Lal Bahadur Shastri Marg, Kasturi Park, Maneklal Estate, Ghatkopar West, Mumbai, Maharashtra 400086",Mumbai
SAI LEELA MARBLE GRANITE,09969801344,"Plot No. 13 - 14 B, Kurla-Andheri Road, Opp Mittal Estate, Shop No. 26 Shree Ram Apartment, Shanti Nagar, Mira Road (E, Andheri East, Mumbai, Maharashtra 400059",Mumbai
"Stone City - Dealers in granite, marble, stone",09967453446,"5RX8+322, Rajput marble market, Marve Road, Malad, Rathodi, Malad West, Mumbai, Maharashtra 400095",Mumbai
Bhairav Bhawani Marble & Granite,09892325949,"Shyam kutir, Veer Makrand Ghanekar Marg, Navpada, Vile Parle East, Vile Parle, Mumbai, Maharashtra 400057",Mumbai
Granite stop,09967436383,"bridge, Pandit Jawaharlal Nehru Rd, Chaitanya Nagar, Davri Nagar, Vakola, Santacruz East, Mumbai, Maharashtra 400055",Mumbai
Quality Marble,09321772395,"Airport Side, Service Road, Western Express Hwy, Vile Parle East, Mumbai, Maharashtra 400099",Mumbai
Ambika Marble and Granite,09867344555,"fire brigde, shop no. 7, twin complex, opp. marol, marol naka, Andheri East, Mumbai, Maharashtra 400059",Mumbai
Standard Granite And Marbles,09820206123,"27, Juhu, Gazdhar Bandh Rd, near SB Patil Road, Santacruz (West), Mumbai, Maharashtra 400054",Mumbai
Color Granite,07666673564,"Mumbra-panvel road, Taluka, opposite shiv mandir, kuthari village, panvel, Maharashtra 410208",Mumbai
Swagat Marble,09322244710,"opp. Pushpanjali building, near Purushottam Kheraj Road, Ramghad, St Pius Colony, Mulund West, Mumbai, Maharashtra 400080",Mumbai
Patashi Granite,08097802341,"3rd phase, sector 23, Plot no 168 169 170, Marble Market, Kalamboli, Panvel, Maharashtra 410218",Mumbai
Super Granites And Marbles,09820092602,"Madni Estate, Behind Famous Timber Mart, Dargah Road, Road, Bhandup Complex, Sonapur, Bhandup West, Mumbai, Maharashtra 400078",Mumbai
Shreenathji Marble & Granite,02226742282,"New Link Rd, opp. Scout Camp, opp. Evershine Park, Behram Baug, Jogeshwari West, Mumbai, Maharashtra 400053",Mumbai
Ranakpur marbles & Granites,07208527252,"bus stop, ajit glass, Swami Vivekanand Rd, Jogeshwari West, Mumbai, Maharashtra 400102",Mumbai
Prime marble,07742094209,"Plot no 6, opp. Raheja Plaza, Industrial Area, Andheri West, Mumbai, Maharashtra 400053",Mumbai
Akash Marble & Granite,02267031960,"3WQ4+W2H, Lal Bahadur Shastri Marg, Gurunanak Nagar, Jivdaya Lane, Ghatkopar West, Mumbai, Maharashtra 400086",Mumbai
Mukesh Marble And Granites,09324053259,"3VPV+7G8, Lal Bahadur Shastri Marg, Gurunanak Nagar, Narayan Nagar, Ghatkopar West, Mumbai, Maharashtra 400086",Mumbai
Shree Gayatri Granites & Marble,09821216577,"Plot No.22/32, to 22/34, Near Bageecha Hotel, Marve Rd, Rathodi, Malad West, Mumbai, Maharashtra 400095",Mumbai
RAKESH MARBLE AND GRANITES.,09820524727,"Vakola Bridge, Pandit Jawaharlal Nehru Rd, opposite Dr Vora Dental Clinic, Chaitanya Nagar, Davri Nagar, Vakola, Santacruz East, Mumbai, Maharashtra 400055",Mumbai
Shankeshwar Marble,08779592911,"16A, Rajput marble market, Malad - Marve Rd, near Petrol Pump, Malad, Rathodi, W, Mumbai, Maharashtra 400095",Mumbai
PARADIGM QUARTZ BY STONEXO LLP,09773052024,"Laxmi Industrial Estate, New Link Rd, near Axis Bank, Laxmi Industrial Estate, Suresh Nagar, Andheri West, Mumbai, Maharashtra 400053",Mumbai
GRANITE POINT,09819705272,"Modern Marble, Dargah Rd, near Yasin Kamal Bakery, Ram Rahim Udyog Nagar, Sonapur, Bhandup West, Mumbai, Maharashtra 400078",Mumbai
Selection Marbles And Granites,08356088295,"Service, Western Urban Rd, near Subway, Vile Parle East, Mumbai, Maharashtra 400057",Mumbai
RISHABH GRANITE & STONE,09594249001,"Mahatma Gandhi Rd, opposite kanyakumari, Gaothan, Pushp Heritage, Dahanukar Wadi, Kandivali West, Mumbai, Maharashtra 400067",Mumbai
Jainam Marble & Granite,09867133558,"4WHC+77J, Adi Shankaracharya Marg, Ramabai Ambedkar Nagar, Powai, Mumbai, Maharashtra 400076",Mumbai
STAR STONE,08652875786,"Shop no 5, Lal Bahadur Shastri Marg, next to friends school, opp. Nirmal Lifestyle Road, Salpa Devi Pada, Mulund West, Mumbai, Maharashtra 400080",Mumbai
"Stone Gallery - Marble, Tiles & Granites",08369219439,"Underground subway, Service Rd, Marble Market, Navpada, Vile Parle East, Vile Parle, Mumbai, Maharashtra 400099",Mumbai
Shubham Marble And Granite,08828446815,"Shop 1, Evershine Green, New Link Rd, Anand Nagar, Jogeshwari West, Mumbai, Maharashtra 400102",Mumbai
Moti Marbles,02228765814,"5R5P+82F, New Link Rd, Bhagat Singh Nagar No. 2, Colony No 1, Goregaon West, Mumbai, Maharashtra 400104",Mumbai
Kohinoor Marble,09967057714,"Shop No:18, Vakola Bridge, Police Station, Pandit Jawaharlal Nehru Rd, near Vakola, Chaitanya Nagar, Davri Nagar, Vakola, Santacruz East, Mumbai, Maharashtra 400055",Mumbai
Kasturi Granites,09702609377,"Plot 12/13 , Sion Panvel Highway Kalamboli Marble Market, Sector 23, Kalamboli, Maharashtra 410218",Mumbai
Rajhans Marble And Granites,09892309464,"1, Mulund - Goregaon Link Rd, Nahur West, Sarvodaya Nagar, Mulund West, Mumbai, Maharashtra 400080",Mumbai
PORIYA IMPEX,07021739834,"Shop No.4 , Hari Bhima Tank Wadi Nr Dindoshi Signal, Western Express Hwy, Malad East, Mumbai, Maharashtra 400097",Mumbai
IVAS QUARTZ Tiles & Granite - Mumbai,09900080007,"Jaisingh Commspace, 201 Service Road, Western Express Hwy, Navpada, Vile Parle East, Mumbai, Maharashtra 400057",Mumbai
Nakoda Marble & Granites,09967667134,"Mulund - Goregaon Link Rd, opp. Runwal Greens, Mulund (W, Sarvodaya Nagar, Mulund West, Mumbai, Maharashtra 400080",Mumbai
Asco Ceramic & Himalaya Marble,09004993803,"Shop No 2, Swami Vivekanand Rd, opp. Oshiwara Post Office, near Ajit Glass Co, Oshiwara, Jogeshwari West, Mumbai, Maharashtra 400102",Mumbai
Padma Prabhu Granite And Marbles - La Spazio,09769381619,"Plot No 487, Padma Prabhu Granite and Marbles, Opp Kanakia Wall Street Andheri Kurla Road, Junction, Chakala, Andheri(E, Mumbai, Maharashtra 400093",Mumbai
Sai Krupa Granite and Marble,09867860934,"Shop no, 7, Service Rd, opp. Hotel Grace Nirvana, near Nana nani Park, Navpada, Vile Parle East, Vile Parle, Mumbai, Maharashtra 400099",Mumbai
Shri Balaji Marble,09892047022,"Shop Number 6, Western Urban Road, Islamiya Bazar, MBH Colony, Pathan Wadi, Malad East, Mumbai, Maharashtra 400097",Mumbai
Kishangarh marble and granite,02226631573,"3RHP+HRG, Main Marble Market, Airport Side Service Road, Western Express Hwy, Vile Parle East, Mumbai, Maharashtra 400054",Mumbai
KAJARIA TILES SHOWROOM,09322871330,"Shop No. 182-A, Irani Chawl, New Prabhadevi Rd, opp. Mulji House, Prabhadevi, Mumbai, Maharashtra 400025",Mumbai
Natural Granites,09322264398,"Western Express Highway Road, Service Rd, Vile Parle East, Mumbai, Maharashtra 400099",Mumbai
SWASTIK GRANITE & MARBLES,09820932335,"Jivraj Compound, 186, Zakaria Bunder Rd, behind VRL Logistics, near Rushabh Tower, Sewri West, Tilak Nagar, Sewri, Mumbai, Maharashtra 400015",Mumbai
Choice Granite & Ceramics in Navi Mumbai (India),08433751858,"Plot no: 108, sec 23, Kalamboli Marble Market, Navi Mumbai, Navimumbai, Maharashtra 410218",Mumbai
Sagar marble and granite,09320415529,"Kandivali, Mahatma Gandhi Nagar, Kandivali West, Mumbai, Maharashtra 400067",Mumbai
Shree granite,07400356789,"Plot 1 ,shop 2, sector 23, Turbhe Rd, Sector 23, Vashi, Navi Mumbai, Maharashtra 400703",Mumbai
M/S Paradise Granites,02225791955,"&, SGS House, Telephone exchange, IIT Road, near India, Chandan Nagar, Vikhroli West, Mumbai, Maharashtra 400083",Mumbai
Agrawal Stone Park,09967361699,"PLOT NO.23, Sion - Panvel Highway, Sector 23, Kalamboli, New Panvel, Panvel, Maharashtra 410218",Mumbai
Gala Granites,09867674847,"Plot No.33, Near Janta Market, CIDCO Industrial Area, Sector 23, Turbhe, Navi Mumbai, Maharashtra 400703",Mumbai
Kajaria Tiles Authorised Showroom - Al-Rahat Granite,09820596824,"Charmee Enclave Bldg, 10, Service Rd, Navpada, Vile Parle East, Vile Parle, Mumbai, Maharashtra 400057",Mumbai
Perfect Granite & Tiles,09820886618,"Govardhan Market Shilphata, Taloja Road, Goteghar, Daighar Gaon, Goteghar, Maharashtra 421204",Mumbai
