store_name,contact_number,address,city
Shiv Darshan Trading Co,07704905102,"6A, Panki - Kalyanpur Rd, opposite Indian oil petrol pump, Kalyanpur, Kanpur, Uttar Pradesh 208017",Kanpur
Kajaria Tiles Authorised Showroom - Ceramic Mall,09670000072,"87/159, G.T. Road, Rai Purwa, Kanpur, Uttar Pradesh 208001",Kanpur
Kajaria Tiles Exclusive Showroom - Badshah Stones Hub,08707738008,"127/98, Hamirpur Rd, near Sai Mandir, S Block, Juhi Kalan, Shakti Nagar, Kanpur, Uttar Pradesh 208014",Kanpur
New Himalaya Marble,07388023719,"Shop No.21, GT రోడ్డు, Geeta Nagar Crossing, Kakadeo, Kanpur, Uttar Pradesh 208002",Kanpur
Kajaria Tiles Authorised Showroom - Marble King,08853173348,"133/373, M Block, Marble Market, Kidwai Nagar, Kanpur, Uttar Pradesh 208011",Kanpur
Kajaria Tiles Authorised Showroom - Amit Tiles,09415127732,"133/20, Y Block, O-Block, Kidwai Nagar, Kanpur, Uttar Pradesh 208023",Kanpur
Kajaria Tiles Authorised Showroom - Hindustan Sanitary And Tiles,09839383830,"75/28, Halsi Rd, Collectorganj, Kanpur, Uttar Pradesh 208001",Kanpur
Elegant tiles,07985954379,"872,Plot no. 9, Awas Vikas, 3, Panki - Kalyanpur Rd, behind petrol pump, Awas Vikas Ambedkar Puram, Kalyanpur, Kanpur, Uttar Pradesh 208017",Kanpur
Woodir,08368602620,"Shop Ground floor, Subhash market, Last, Panki - Kalyanpur Rd, near Gayatri Mandir, Gooba Gardens, Kalyanpur, Kanpur, Uttar Pradesh 208017",Kanpur
Kajaria Tiles Authorised Showroom - Shri Ram Tiles,09140779962,"First Floor, 57, Rampuram Yojna, Shyam Nagar, Kanpur, Uttar Pradesh 208013",Kanpur
Kajaria Tiles Authorised Showroom - Kaushik Tiles And Sanitary Ware,09450154102,"Plot No. 61, Panki - Kalyanpur Rd, Kalyanpur, Kanpur, Uttar Pradesh 208017",Kanpur
Kajaria Tiles Exclusive Showroom - Sheela Marble,09336210855,"2A/97, near Subji Mandi, Azad Nagar, Kanpur, Uttar Pradesh 208002",Kanpur
Kajaria Tiles Exclusive Showroom - O.P.Agarwal & Co,09721344445,"457 A, 2, Nawabganj, Kanpur, Uttar Pradesh 208002",Kanpur
"ASHOK MARBLE (MARBLE, GRANITE AND TILES)",09935722411,"69, Kidwainagar Rd, O Block, Marble Market, Kidwai Nagar, Kanpur, Uttar Pradesh 208023",Kanpur
Sharda traders,07309043602,"13 juhi, Damodar Nagar, Uttar Pradesh 208027",Kanpur
Ajay Marbles & Traders,07355537955,"Ajay Marble, K Block, 336 B, 80 Feet Rd, Gopal Nagar, Yashoda Nagar, Kanpur, Uttar Pradesh 208011",Kanpur
Kooshmanda Tiles and Sanitary,09336286464,"133/27, Kidwainagar Rd, O Block, Marble Market, Kidwai Nagar, Kanpur, Uttar Pradesh 208023",Kanpur
Mehir Ceramics,09565328322,"133/681 E- 1, Naya Purwa, Marble Market, Kidwai Nagar, Kanpur, Uttar Pradesh 208023",Kanpur
Baba Granite Wholesale Shop,09335390365,"127/390 S, Jawahar Rd, Baradevi, Juhi Kalan, Juhi, Kanpur, Uttar Pradesh 208014",Kanpur
Prince marble,08004661647,"133/745, M Block, Babakuti, Kanpur, Uttar Pradesh 208023",Kanpur
"Shree ranabai MARBLE , GRANITE & TILES",08949891624,"Indira Nagar, Kalyanpur, Kanpur, Uttar Pradesh 208017",Kanpur
Tanishka Marbles and Tiles,08299010360,"O Block, 167, Kidwai Nagar Bypass Rd, Naya Purwa, Marble Market, Kidwai Nagar, Kanpur, Uttar Pradesh 208023",Kanpur
Shree Ram Marble And Granite (राजस्थान वाले),06375297778,"97, Kanpur - Allahabad Hwy, Chakeri Ward, Kanpur, Uttar Pradesh 208007",Kanpur
Nandini Tiles Marbels & Granite,07007058273,"Plot no. 279 Sagarpuri Road,Bingavan, Singh vihar, Pahadpur, Kanpur, Uttar Pradesh 208021",Kanpur
"Shree Ram tiles, Marble AND Sanitary",06392687826,"7, Purana Shivali Rd, Gooba Gardens, Kalyanpur, Kanpur, Uttar Pradesh 208017",Kanpur
Shree Madhav Marble & Granite,09450745976,"Indra Nagar Road, Indira Nagar, Kalyanpur, Kanpur, Uttar Pradesh 208026",Kanpur
Tiles & Marble Fitting Mistri Kanpur,08318837236,"17 U SBI Colony, Nirala nagar, Uttar Pradesh 208014",Kanpur
Tiles & grenite fitting mistri kanpur,07521819274,"Maksoodabad, Kalyanpur, Kanpur, Lohar Khera, Uttar Pradesh 209217",Kanpur
The stone World,09455227737,"SA 4/73 A-4k Nai Basti, near V Mart, Paharia, Varanasi, Uttar Pradesh 221002",Varanasi
Laxmi Granite And Marble,09695094594,"Shivpur Bypass Rd, Suddhipur, Shivpur, Varanasi, Uttar Pradesh 221003",Varanasi
salasar marble & granite (SMG Marble),09855974710,"Shivpur Bypass Rd, near front roti dhaba, Shivpur, Varanasi, Uttar Pradesh 221003",Varanasi
Balaji Marbles - Samneghat,09336912261,"Plot Number 3 Ramnagar Road, Samne Ghat Rd, Samne Ghat, Lanka, Varanasi, Uttar Pradesh 221005",Varanasi
Granite Name plate Shop,09450744362,"Sankatha Nagar Colony, SA-131/A, near Shiv Temple, Shiv Nagar Colony, Pandeypur, Varanasi, Uttar Pradesh 221002",Varanasi
R.K. stone and sanitary,09005485307,"Chunar Rd, Amara Village, Awaleshpur, Varanasi, Kandwa, Uttar Pradesh 221106",Varanasi
Rajasthan Marble and Tiles,09616406042,"Sigra - Mahmoorganj Rd, opp. Hotel Padmini, Near Padmini Hotel, Mahmoorganj, Varanasi, Uttar Pradesh 221010",Varanasi
Decor Banaras | best tiles shop in Varanasi,08299119569,"924G+W6Q Chandra Chauraha, Srigee Complex, Ashapura Road, Asapur, Varanasi, Uttar Pradesh 221007",Varanasi
Sharda Marbles,09415817904,"Samne Ghat Rd, Samne Ghat, Nagwa Lanka, Varanasi, Uttar Pradesh 221005",Varanasi
S.M. MARBLES | Tiles Shop In Varanasi | Best Tiles Showroom | Marbles Shop Near Me |,07518804452,"1059/ A, near IP Mughal, Mughalsarai, Uttar Pradesh 232101",Varanasi
M R TILES,07395031165,"Kapildhara Rd, near punjabi hospital, Kapildhara, Salarpur, Varanasi, Uttar Pradesh 221112",Varanasi
Shri Bhairunath Rajsthan Marbles –,09554400053,"D 59/80-1, D 59/98 A-14, Sigra - Mahmoorganj Rd, Mahmoorganj, Varanasi, Uttar Pradesh 221010",Varanasi
"Natraj Marble,Somany Tiles & Bathware",09439533425,"Ramnagar, bhitti, near hindustan unilever godown, near gas godown, Ramnagar, Varanasi, Uttar Pradesh 221008",Varanasi
Kajaria Eternity World - Tiles Showroom in Chitaipur Road Varanasi,09336075465,"Anant Marbles Chitaipur Road, Bypass, near Akhri, Varanasi, Uttar Pradesh 221106",Varanasi
Makrana Sanitary And Tiles,09415226438,"S. 29, by Interdecor, 131, Shivpur Bypass Rd, opposite to Arancia Kuchen, Lalji Kuwa, Shivpur, Varanasi, Uttar Pradesh 221003",Varanasi
Anant marble,09336075465,"G T Road rohania kesharipur, Rohaniya - DLW Road, Varanasi, Uttar Pradesh 221108",Varanasi
Shri Ram Tiles and Sanitery | Best Tiles Shop in Chitayipur | Best Sanitery Dealer in Chitayipur,07668953736,"Nikat Mayank Medical, Awleshpur, Chunar Rd, Chitaipur, Varanasi, Uttar Pradesh 221106",Varanasi
"AK & SON'S (Tiles, Granite, C.P Sanitary)",06307304121,"Narayanpur Suswahi Chauraha Dafi, Bypass, near Nuawn Sabji Mandi, Varanasi, Uttar Pradesh 221011",Varanasi
shree balaji marble granite and tiles,09005550585,"GT Rd, opp. Rudra Apartment, Parao, Dandi, Madiya, Uttar Pradesh 232101",Varanasi
Marble Stone,07800550009,"Akhari, Varanasi, Uttar Pradesh 221011",Varanasi
Rishika marble & Tiles,09454319820,"6XX3+PVR, Amra aakhri Bypass, Chunar Rd, near Bank of India, Awaleshpur, Varanasi, Uttar Pradesh 221106",Varanasi
Kajaria Tiles Exclusive Showroom - Jamal Saw Mills,09936091632,"Jamal Saw Mills, SA - 22 / 175-D-G-N, Puranapull, Uttar Pradesh 221112",Varanasi
Bath Collection,09415204223,"Bath Collection, 71 KA, Bhullanpur, Churamanpur, Varanasi, Uttar Pradesh 221108",Varanasi
"NITCO Exclusive Partner - Laxmi Granite And Marble I Designed Tiles for Bathroom, Kitchen, Wall & Floor in Varanasi",08037784174,"Bypass Road, nearby Health City Hospital, Sarayswami, Varanasi, Uttar Pradesh 221105",Varanasi
"Kajaria Experience Centre - Tiles Showroom in Tax Office, Varanasi",05422500483,"1st Floor, Regional Office & Display Centre for Ceramic Wall & Floor Tiles, Trade Centre, Plot No. 154/2A, Maqbool Alam Rd, near Income Tax Office, Hamrautia, Varanasi, Uttar Pradesh 221002",Varanasi
Galaxy Marble,09936136135,"SA 21/48-A, Sarnath Rd, Panchcrosi Sabzi Mandi, DIndayalpur, Varanasi, Uttar Pradesh 221007",Varanasi
Shah Marble,09336912919,"8XRR+W8G, Maqbool Alam Road Khajuri near District Jail, Varanasi, Uttar Pradesh 221002",Varanasi
Kajaria Tiles Authorised Showroom - R K Marbles,09839041677,"B.38/49, Mahmoorganj, Varanasi, Uttar Pradesh 221010",Varanasi
Kajaria Tiles Authorised Showroom - Shree Krishna Marble,07985826224,"Gaoura Kala Chirae, Gov, Ram nagar, Varanasi, Uttar Pradesh 221001",Varanasi
Baba Tiles And Sanitary,09451819375,"Jjanki Nagar, Varanasi, Uttar Pradesh 221106",Varanasi
Gs Marble,08840505818,"Piyariya Pokhari, Maqbool Alam Rd, Andhrapull, Teliyabag, Varanasi, Uttar Pradesh 221002",Varanasi
Maurya Tiles & Sanitary,09839715717,"Near, Satrangi Tiraha, Salarpur, Varanasi, Dinapur, Uttar Pradesh 221112",Varanasi
Rohit Marble,09415390021,"Christ Nagar Near Chandmari Police Check Post, Sindhora Rd, Varanasi, Uttar Pradesh 221003",Varanasi
Varanasi Tiles& Marble,09198701559,"Up, near Maldahiya, nilcotej, Varanasi, Uttar Pradesh 221002",Varanasi
SK TILES AND SANITARY,09555842623,"near hero showroom, Jansa, Varanasi, Uttar Pradesh 221405",Varanasi
"Galaxy House Tiles ,Sanitary Ware And C P Fitting",09519565758,"chanari, Dandupur, Uttar Pradesh 221003",Varanasi
RYS Traders,07007439116,"Rohaniya - DLW Road, Bhullanpur, Gobindpur, Varanasi, Uttar Pradesh 221108",Varanasi
Kajaria Tiles Authorised Showroom - HHN Trading Company,09794979416,"S-7/8-B, Golghar, Anaula Taktapur Contonment, Kachehri, VDA Colony, Varanasi, Uttar Pradesh 221002",Varanasi
Bhavan Shree Marble And Sanitary,09473682092,"7WH2+5QX, National Highway 29, Sahavabad, Uttar Pradesh 221302",Varanasi
"Kajaria Eternity World - Tiles Showroom in Kesharipur Rohaniya, Varanasi",09984610510,"Anant Marbles Rohania, Rohaniya, Varanasi, Kesharipur, Uttar Pradesh 221108",Varanasi
K V Tiles House,08874128561,"7X97+R3W, Panchkoshi Road, Anand Nagar, Chitaipur, Varanasi, Kandwa, Uttar Pradesh 221106",Varanasi
Fauzi Tiles & Marbles,06392009214,"Fauzi Katra beside Hanuman Mandir Tengra Mode, NH-2, Ramnagar, Uttar Pradesh 221008",Varanasi
Prakash Group,09415336509,"Chhota Lalpur, Azamgarh Rd, Pandeypur, Varanasi, Uttar Pradesh 221002",Varanasi
"Jk brothers.Best Tile shop in varanasi,best sanitaryware shop in varanasi.Tiles,tile adhesive,mirror",09651875643,"Chitaipur - Kandwa Rd, near gyandeep academy, Awaleshpur, Varanasi, Uttar Pradesh 221106",Varanasi
Astha Tiles & Marble,09889720569,"Balua Rd, Tilamapur, Varanasi, Uttar Pradesh 221007",Varanasi
SBM Marble(sonu Building Marerial & Hardware),08004060606,"Unnamed Road, Balirampur, Parmanandpur, Gobindpur, Uttar Pradesh 221108",Varanasi
Kajaria Tiles Authorised Showroom - AK Brothers,09795683731,"Kachhawa Road, Om Nagar Colony, Thatara, Danganj, Varanasi, Uttar Pradesh 221307",Varanasi
Kajaria Tiles Exclusive Showroom - Jamal Marble House,08400257786,"KA - 5, SA22 / 175, Puranapul, Varanasi, Uttar Pradesh 221007",Varanasi
"Kajaria Prima Plus - Tiles Showroom in Mandaudih, Varanasi",09990805000,"S.S. Traders, Tarkeshwar Nagar, Shivdaspur,, (DLW, Lahartara Road), Mandaudih, Varanasi, Uttar Pradesh 221103",Varanasi
Aashiyana,09792262613,"729H+XQW, Fort Rd, Mansa Devi, Ram nagar, Varanasi, Ramnagar, Uttar Pradesh 221008",Varanasi
"Kajaria Prima Plus - Tiles Showroom in Manduadia, Varanasi",08303401168,"Tiles and Granite Solutions Manduadih, Madhauli Road, in front of true value cars, Manduwadih, Varanasi, Uttar Pradesh 221010",Varanasi
"JK Brothers. Best tile shop in varanasi.Cera ,Somany tile,floor tiles,wall tiles,best cera,ultratech dealer,waterproofing",09651875643,"D59/132, Christ Market, Sigra - Mahmoorganj Rd, Mahmoorganj, Varanasi, Uttar Pradesh 221002",Varanasi
"Dhan laxmi marble and granite's,italian,Tiles",09783215783,"9XGC+M84, Khushal Nagar, Sector -B, Bada Lalpur, Chandmari, Lalpur, Uttar Pradesh 221002",Varanasi
Vasundhara Marbles,07905214851,"Chitaipur - Chunar Rd, Chitaipur - Kandwa Rd, Awaleshpur, Varanasi, Uttar Pradesh 221106",Varanasi
Adesh Traders,09795683731,"Kachhawa Rd, near indian bank, varanasi, Thatra, Uttar Pradesh 221313",Varanasi
"H & R Johnson Tiles - Mimar Tiles & Plywood - Best Tiles for Bathroom, Kitchen, Wall & Floor in Sarnath Road",08037908031,"Purana Pul, Infront of HDFC Bank, Plot No SA 22/79 E1, Sarnath Rd, Varanasi, Uttar Pradesh 221007",Varanasi
Orientbell Tiles Boutique - Maa Parwati Traders,09167443873,"Ground Floor, opposite Hari Bandhu ITI, Ledhupur, Varanasi, Uttar Pradesh 221112",Varanasi
Ganpati Marble And Sanitary Palace( Somany Dealer),09651784515,"Majhwar Rd, Gautam Nagar, Chandauli, Uttar Pradesh 232104",Varanasi
"H & R Johnson Tiles - Om Sai Creations - Best Tiles for Bathroom, Kitchen, Wall & Floor in Varanasi",08037908005,"Near, Belwa Baba Bazar, Azamgarh Rd, Lamhi, Varanasi, Uttar Pradesh 221007",Varanasi
Varanasi Tiles,08009800222,"11, Suddhipur, Shivpur, Varanasi, Uttar Pradesh 221002",Varanasi
Sahuji malti marble tiles and pipes,08922006555,"Dheeraj market kuar bazar Varanasi, Jamalapur-Babatpur Link Rd, Tetua, Uttar Pradesh 221206",Varanasi
J. P. Sanitary Home,09450096803,"72V2+437, Durgakund Rd, Gurudham Chauraha, Opposite PNB ATM, Near Prachin Hanuman Mandir, Durgakund, Anandbagh, Bhelupur, Varanasi, Uttar Pradesh 221001",Varanasi
Stonemart | Best Marble Supplier Near Me | Best Italian Marble in Varanasi | Best Granite Collection in Varanasi,09839041677,"Shivpur Bypass Rd, Shivpur, Varanasi, Uttar Pradesh 221003",Varanasi
"Kumawat Marble and Granite(Godown), Varanasi",09451570663,"Rohaniya - DLW Road, opp. to Anant hospital, Balirampur, Varanasi, Gobindpur, Uttar Pradesh 221108",Varanasi
Shiv shakti marble granite and tiles,09580416159,"Shivpuri bypass, near subham vatika, Laxmanpur, Varanasi, Uttar Pradesh 221002",Varanasi
Shree veer Teja marble and granite,09460979672,"Shivpur Bypass Rd, near Goutam garden, Bagatpur, Varanasi, Uttar Pradesh 221003",Varanasi
Shree Vinayak Marble&Granite,08114463383,"Chunar Rd, near shivdham nagar colony, Shivdham Nagar Colony, gate, Bari bazar, Amara Khaira Chak, Varanasi, Uttar Pradesh 221106",Varanasi
Hari Om Traders,09450014104,"8298+XGR, Gudhatta, Near Kisan Enterprises, Daranagar, Bisweshwarganj, Varanasi, Uttar Pradesh 221001",Varanasi
Shree Balaji Marble And Garnite,08290642955,"STP Plant, Near, Azamgarh Rd, Rajnahiya, Uttar Pradesh 221007",Varanasi
Life Line Electricals And Sanitary,09919901888,"Life Line Elecricals And Sanitary, Balua Rd, Asapur, Varanasi, Uttar Pradesh 221007",Varanasi
Salasar balaji marble & granite (राजस्थान वाले),07878652695,"Akhari bypass, near shri unity ispat &, near ola charging, Awaleshpur, Varanasi, Akhari, Uttar Pradesh 221011",Varanasi
SHRI SHYAM MARBLE & GRANITE,08058068553,"Varanasi, Barwapur, Uttar Pradesh 221101",Varanasi
AVISHRI MARBLE AND GRANITE,09451888337,"Opposite Chandra hospital kerakatpur, Lohta, Varanasi, Uttar Pradesh 221107",Varanasi
New rajasthan marble & Granite,06387321003,"8354+WV6, Parao, Padao, Madiya, Uttar Pradesh 232101",Varanasi
Veer Teja granite and marble,08696306136,"Shandha gazipur road, near by pal dharm kata, Varanasi, Uttar Pradesh 221112",Varanasi
A One Marble and Granite,09116666649,"Grand Trunk Rd, near banswari hotel, Andawa, Prayagraj, Uttar Pradesh 221505",Allahabad
"Balaji Marble , Granites & Tiles",09455295546,"2/2, Tej Bahdur Sapru Rd, Agnipath Colony, Civil Lines, Prayagraj, Uttar Pradesh 211001",Allahabad
Raj Granite & Tiles Trading Co,09918625658,"Airports Mod, Khelgoan School Road, near Gaddi Chauraha, Prayagraj, Saha Urf Pipalgaon, Uttar Pradesh 211015",Allahabad
Maharaja Marbles,08935001762,"Shop No. 22/C, Katghar Rd, near Bholagiri Mandir, Mutthi Ganj, Prayagraj, Uttar Pradesh 211003",Allahabad
SV Marbles & Granites,09696595253,"Ram Nagar Chauraha Amazon office pickup point, Uttar Pradesh 211008",Allahabad
Shiv Mahima Italian Marbles & Granite,09161828888,"4/4 B.1 A, Hashimpur Road, Balson Chauraha, near Sagar Ratna, Prayagraj, Uttar Pradesh 211002",Allahabad
Dakhi Lal Kesarwani Sangmarmar udhyog,09984553355,"635, Colnel Ganj, Colonelganj, Prayagraj, Uttar Pradesh 211002",Allahabad
Prakash Traders,09453571450,"17/b, Kanpur - Allahabad Hwy, Sulem Sarai, Dhoomanganj, Prayagraj, Uttar Pradesh 211011",Allahabad
Rajasthan Marbles & Tiles-Tiles Dealer/Granite Marble/Marble Mandir Dealer,09335165961,"Dairy Compound, k bagal mein Purana, Haima-Kutir Rd, Rambagh, Prayagraj, Uttar Pradesh 211003",Allahabad
Tridha Marbles (Rak Ceramics),09839780111,"647, Matiyara Rd, near Bank of Baroda, Bhardwaj Puram, Punjabi Colony, Shiv Nagar, Allahpur, Prayagraj, Uttar Pradesh 211006",Allahabad
"Jaiswal AGL Tiles, Cement, Saria & Sanitary Stores",09795590536,"146/68D/1A, Muir Rd, near Hanuman Mandir Chauraha, Om Nagar, Rajapur, Prayagraj, Uttar Pradesh 211002",Allahabad
Kajaria Tiles Exclusive Showroom - Grover Steel,07607956703,"Grover Steel 79/99, Mundera Rd, Meera Patti, Prayagraj, Uttar Pradesh 211011",Allahabad
Siyaram Stone & Marbles,09415216670,"439A/440, Dabhaw, Nani (211008, Prayagraj, Uttar Pradesh 211008",Allahabad
HRS STONES (Regional Office),09336102367,"aboobakapoor, Preetam Nagar, Prayagraj, Uttar Pradesh 211011",Allahabad
Kajaria Tiles Authorised Showroom - Sachin Tiles And Marbles,07860865745,"385, Chak Rahhunath, near Hotel India, Naini, Prayagraj, Uttar Pradesh 211008",Allahabad
G.P associates,07668503617,"1056A/2B Om Prakash Sabhasad Nagar, Gas Godown, Kalindipuram, Rajrooppur, Prayagraj, Uttar Pradesh 211015",Allahabad
Rajasthan Marble & granite wholesale Shop,06375626726,"9V8H+CQ7, Naini, Chak Devanand, Prayagraj, Uttar Pradesh 211010",Allahabad
VIKAS SANITARY AND MARBLES,08874909394,"LANDMARK:ICIC BANK, 167/A, Old Canton, Teliarganj, Prayagraj, Uttar Pradesh 211004",Allahabad
Prayag Marbles,08840090121,"P-186, J K Nagar, Kala Danda, Prayagraj, Daiwghat, Uttar Pradesh 211016",Allahabad
Krishna Tiles and Marbles,09957555556,"13a/9a/1, श्री Radhey Complex, Mewalal ki Bagiya, near UCO Bank, Daud Nagar, Naini, Prayagraj, Uttar Pradesh 211008",Allahabad
Shyam And Company,09415236756,"House No 15, Bank Rd, behind Girls Hostel, Old Katra, Prayagraj, Uttar Pradesh 211002",Allahabad
"United Marbles & Building Materials - H & R Johnson Tiles - Best Tiles for Bathroom, Kitchen, Wall & Floor in Jhalwa",08037907966,"No 4, IIT Road, nearby IIT Gate, Indian Institute of Information Technology, Devprayagam Colony, Jhalwa, Prayagraj, Uttar Pradesh 211015",Allahabad
Kajaria Tiles Authorised Showroom - Shiv Mahima Italian Marble And Granite,09161828888,"House No 4/4, Bhukhand No. 1A, Hashimpur Rd, Extension Scheme, George Town, Prayagraj, Uttar Pradesh 211002",Allahabad
"H & R Johnson Tiles - Best Tiles for Bathroom, Kitchen, Wall & Floor in Mundera Bazar",08037907895,"Infront of Laxman Vatika Guest House, Shop No 65/80B, Mundera Bazar, Prayagraj, Uttar Pradesh 211011",Allahabad
Satyam Traders - Orientbell & Johnson Tiles,07318302692,"44, 13G, Harwara, Dhoomanganj, Prayagraj, Uttar Pradesh 211011",Allahabad
Apna Marble House,09307880647,"Kalindipuram, Prayagraj, Daiwghat, Uttar Pradesh 211015",Allahabad
Vivek & Company,09450626750,"90A/1, Chak Lal Mohamad, Naini Allahabad, Stockist Mehar Cement Prince Cement, Naini, Prayagraj, Uttar Pradesh 211008",Allahabad
SKYLINE DDECORS,09336814383,"University Road, Old Katra, Prayagraj, Uttar Pradesh 211002",Allahabad
Kajaria Tiles Authorised Showroom - Shyam & Co,09415340034,"22A/11, Tej Bahdur Sapru Rd, near Rastogi Dental Clinic, Agnipath Colony, Civil Lines, Prayagraj, Uttar Pradesh 211001",Allahabad
"VIJAY LAXMI MARBLE UDYOG - Best floor, wall, kitchen & Bathrom Tiles",09415631179,"119, 1, Meera Patti, MIG Preetam Nagar Colony, Dhoomanganj, Prayagraj, Uttar Pradesh 211011",Allahabad
Mangala Granites & marbles,07570000962,"GRMM+M77, Malak harhar, Uttar Pradesh 211013",Allahabad
Kajaria Tiles Exclusive Showroom - Rock Yard,09451905224,"Grand Trunk Rd, Andawan, Jhusi, Prayagraj, Uttar Pradesh 211019",Allahabad
Kajaria Tiles Exclusive Showroom - R.P. Associates,09450628749,"R.P. Associates, GA1/8, Trivenipuram, Jhusi, Prayagraj, Uttar Pradesh 211019",Allahabad
Vaibhav Tiles & Marble,09580986460,"Chandapur morahu, Malaka, Uttar Pradesh 211013",Allahabad
Kajaria Tiles Exclusive Showroom - Kesharwani Brothers,09415214715,"21, University Road, Purana Katra, George Town, Prayagraj, Uttar Pradesh 211002",Allahabad
Kajaria Tiles Exclusive Showroom - Bhawan Shree,09453770001,"106, Rambagh, Prayagraj, Uttar Pradesh 211003",Allahabad
Kajaria Tiles Authorised Showroom - Nirmaan Homes,07388877777,"9/5, opp. Janta Petrol Pump, Dandi, Prayagraj, Uttar Pradesh 211008",Allahabad
SHREE MANKAMESHWAR MARBAL AND GRANITE,06387433123,"IN, ALLAHABAD ROAD, Prayagraj, Shankargarh, Uttar Pradesh 212108",Allahabad
Kajaria Tiles Authorised Showroom - Galaxy Marble House,09936636395,"Galaxy Marble House 34, Pura Fateh Mohammad, Naini, Prayagraj, Uttar Pradesh 211008",Allahabad
Aman Marble & Tiles,09936357581,"CRF9+6FR, Solah Market,Near Abubakar Masjid,Jamuna Valley School,Kareli, Prayagraj, Uttar Pradesh 211016",Allahabad
"Best Tiles Designs for Bathroom, Kitchen, Wall & Floor in Merapatti, Prayagraj",09554155055,"Sanjay Marble & Hardware 160/5/125-A, Merapatti Infront of PAC Gate, Uttar Pradesh 211011",Allahabad
Prayagraj marble and granite,08172949020,"near sai baba temple, Devprayagam Colony, Jhalwa, Prayagraj, Dadanpur, Uttar Pradesh 211015",Allahabad
Mohit Marble & Granite,09818198653,"Sri sai nath p.g.i.homeopathy research centre, Prayagraj, Uttar Pradesh 212208",Allahabad
Gupta traders,09598511575,"Rewa Rd, Dandi, Prayagraj, Uttar Pradesh 211003",Allahabad
Hari OM marble & Granite,07426849244,"adjacent Rajendra Toyota, Prayagraj, Khanupur, Uttar Pradesh 221505",Allahabad
S.S brothers (marble house),09839057751,"7QMJ+346, SH 35, Jasra, Uttar Pradesh 212107",Allahabad
Kajaria Tiles Authorised Showroom - Kesharwani & Sons,08318174147,"G.T. Road, Hanuman Ganj, Baraepur, Uttar Pradesh 221505",Allahabad
"NEW SAVITRI MARBLE, TILES & SANITATRY",09935617674,"Koilaha, Rasoolabad Urf Koilha, Uttar Pradesh 212213",Allahabad
New Ashish Traders,09956785796,"343/278D, Old Bairhana, Parade Ground, New Bairahana, Prayagraj, Uttar Pradesh 211003",Allahabad
Ak Traders,06386761206,"Airport road, near airavat chauraha, Saha Urf Pipalgaon, Uttar Pradesh 211012",Allahabad
Vinayak marble and granites,09785753210,"CWGQ+7VM, Andawa, Jhusi Kohna, Uttar Pradesh 221505",Allahabad
"Aakash Marbles Granite, Tiles & Bath",09027265520,"422/12, R.T.O. Road, Shastri Nagar, Hapur Road, Meerut, Uttar Pradesh 250002",Meerut
MK MARBLES TILES & GRANITE,07217433290,"ROYAL GARDEN, 78, Hapur Rd, near by Ring Road, ke pass, Shakarpur, Meerut, Uttar Pradesh 250002",Meerut
Goel Marble & Granite,09412200508,"8/10, Gurudwara Rd, Zaidi Nagar Society, Sector 9, Shastri Nagar, Meerut, Uttar Pradesh 250002",Meerut
Indian Marble & Stone Co.,07060090388,"Chowk, Manoranjan Park, Saket, Meerut, Uttar Pradesh 250001",Meerut
Ashoka Marble And Granite,09990920892,"N H 58, Meerut, 2M53+W45, Meerut Bypass Road, Meerut Division Delhi, Uttar Pradesh 250001",Meerut
Jain Marble Home,09899901094,"91 sadar naya bazar meerut cantt, National Highway, Sotiganj, Meerut, Uttar Pradesh 250001",Meerut
Bhawani marbles,09012007030,"Tejgarhi, Garh road Near Bharat hospital, opp. Buddha garden, Meerut, Uttar Pradesh 250004",Meerut
Harish Marble,09897052619,"Garh Rd, Gokalpur, Meerut, Datavali Gesupur, Uttar Pradesh 250004",Meerut
Ktc Pop & Marbles,09319036582,"150, futa Road, Madhav Puram, Meerut, Uttar Pradesh 250002",Meerut
GS Marbles,09627279810,"A, 315, near PNB Bank, Rajendra Puram, Radha Garden, Ganga Nagar, Meerut, Uttar Pradesh 250001",Meerut
Shri ji Mahalaxmi Marble & Granite,09837264604,"Bypass kankarkhera, near grand 5, Meerut, Uttar Pradesh 250001",Meerut
Panchhi marbles,08938002655,"A-1 Sector-2 Ved Vyas Puri Delhi-Haridwar Bypass Meerut, 250002",Meerut
Aadinath Marble,09927087199,"Rajendra Puram, Radha Garden, Ganga Nagar, Meerut, Uttar Pradesh 250001",Meerut
Adarsh Marbles,08057515151,"W End Rd, Bombay Bazar, Rajban Bazaar, Meerut, Uttar Pradesh 250001",Meerut
Shree tirupati balaji marble,09999417853,"NH58, Nangla Tashi, Meerut, Uttar Pradesh 250001",Meerut
Aaditya Marbles,09837400321,"shop no 8-9 Shyam plaza under mewla, flyover, Meerut, Uttar Pradesh 250002",Meerut
Bhagwati Marbles & Bath Palace,07017353532,"6/7, Garh Rd, Samrat Palace, Panchsheel Colony, Meerut, Uttar Pradesh 250001",Meerut
STONE MART GRANITE & TILES,08740839472,"XJJV+MPV, Meerut, Uttar Pradesh 250005",Meerut
Kajaria Tiles Authorised Showroom - Mahaveer Tiles And Granite,09997921000,"Ground Floor, Ganga Nag, C-08, Mawana Rd, Pocket - G, Poc, Ganga Nagar, Meerut, Uttar Pradesh 250001",Meerut
Shubam Marbles Tiles And Granite,08439566646,"123, Shree Shyam Plaza, Shop No. 18 Shri Shyam Plaza, Baghpat Road, Rishi Nagar, Meerut Delhi, Uttar Pradesh 250002",Meerut
Kajaria Tiles Authorised Showroom - Adarsh Marble,09897515151,"Adarsh Marble, 274, Circular Rd, near Hanuman Chowk, Bombay Bazar, Sadar Bazaar, Meerut, Uttar Pradesh 250001",Meerut
Kajaria Tiles Authorised Showroom - Harish & Brothers,09897859790,"Shop no 50/2, main, Garh Rd, near timbak too restaurant, Kalyan, Meerut, Uttar Pradesh 250002",Meerut
Kajaria Tiles Authorised Showroom - Satwai Marbles,08938003300,"Satwai Marbles 326, Baghpat Rd, near Baghpath Bypass, Meerut, Uttar Pradesh 250005",Meerut
Dhaka Tiles & Traders,09837888196,"XMG5+849, Bhola Rd, Krishna Vihar, Rishi Nagar, Meerut, Uttar Pradesh 250005",Meerut
"Kajaria Prima Plus - Tiles Showroom in Shastri Nagar, Meerut",09897324045,"Garg Tiles & Sanitaryware, F/1, Kuti Chowk, Shastri Nagar, Meerut, Uttar Pradesh 250002",Meerut
EMPIRE CLADDING STUDIO - FLEX STONE,08859599909,"262-D, Delhi Rd, near BJS Gurudwara, Devpuri, Meerut, Uttar Pradesh 250002",Meerut
SUNRISE MARBLES,07078297597,"Bijli Bamba Bypass Rd, Jainpur, Meerut, Uttar Pradesh 250002",Meerut
M.S Hamdan Marbles Tiles & Granite,09457248047,"13, Kithaur Mawana Road Meerut, Vwjr+Fj Issapur, Meerut Division Delhi, Meerut, Uttar Pradesh 250104",Meerut
