store_name,contact_number,address,city
Chamunda Granite Marble,09030409191,"Near:Rock Hills Kaman, Plot No:7, LB Nagar - Uppal Rd, near reliance petrol pump, Rock Town Residents Colony, Sai Nagar, Nagole, Hyderabad, Telangana 500068",Hyderabad
Charbhuja marbles the italian gallery,09949200100,"Plot no 12, Inner Ring Rd, beside Jai Bhavani Jewellers, Mamatha Nagar Colony, Kothapet, Hyderabad, Telangana 500068",Hyderabad
VINAYAKA GRANITES,09848502222,"55/A, Inner Ring Rd, Mamatha Nagar Colony, Mamatha Nagar, Venkata Ramana Colony, Nagole, Hyderabad, Telangana 500068",Hyderabad
Ke Granites and Tiles (Display Center),08978551667,"Ground Floor, M C S, 22-194/8/part, Rallaguda Rd, opp. Registration Ofc, Shamshabad, Hyderabad, Telangana 501218",Hyderabad
Mangalam Grani Mart,09652897787,"Showroom, Plot No.3, Survey No.109,Snehapuri Colony Main Road,Near Chevrolet Car, Nagole-Uppal Frontage Rd, New Nagole, Adarsh Nagar Colony, Hyderabad, Telangana 500039",Hyderabad
Sri Ganapathi Granites,09000008210,"near, Plot no. 21, shiva ganga colony, L. B. Nagar, Telangana 500068",Hyderabad
Devi Marbles and granites,09885286301,"Vignanapuri Colony, Devi Nagar, Mythri Nagar, Kukatpally, Hyderabad, Telangana 500072",Hyderabad
Granite Store,09573632176,"Uppal, Hyderabad, Telangana 500102",Hyderabad
New Limra Granites,09866333415,"Inner Ring Rd, Babul Reddy Nagar, Katedhan, Hyderabad, Telangana 500077",Hyderabad
AMBIKA MARBLE AND GRANITES,09885378429,"2-4-208/8, near snehapuri colony, Snehapuri Colony, Nagole, Hyderabad, Telangana 500102",Hyderabad
Tiles Pro granite contractor vikaspawar,07893132587,"sai dham, Khadgaon Road, Hydershakote, Hyderabad, Telangana 500091",Hyderabad
Sky Tiles & Granite,07331125860,"Nekumpura, Shop No 25, Opp A R Palace Function Hall, Pasha Colony, Alkapoor, Puppalguda, Hyderabad, Telangana 500089",Hyderabad
Ke Granites and Tiles (Warehouse),08978551667,"Sama enclaves, PMPR swimming pool, Plot No. 183/A, Lane, Shamshabad, Hyderabad, Telangana 501218",Hyderabad
G.S. Granites And Marbles,04031907755,"FCGC+RR3, Opposite DMart Kukatpally, IDA Kukatpally, Kukatpally, Hyderabad, Telangana 500072",Hyderabad
Ronak Marble and Granites,09849765527,"House No 2-1-277/3/A, Mamatga Nagar, Nagole x Road, Hyderabad, Telangana 500068",Hyderabad
Rishabh Marble & Granite,09885222390,"62, Kamalapuri Colony, Kamalapuri Colony, near Srinagar Colony, Hyderabad, Telangana 500073",Hyderabad
Hyd Tiles/Granite/marble Laying sarvice,09874767805,"city's, Gachibowli - Miyapur Rd, Vittal Rao Nagar, HITEC City, Hyderabad, Telangana 500081",Hyderabad
Jagdamba Granite & Tiles,09440515091,"Plot no 66A, X road, Mamatha Nagar Colony, Nagole, Hyderabad, Telangana 500068",Hyderabad
Balaji Marbles And Granites,09949063251,"plot no-7/A, Sai prakash nagar, Karmanghat Rd, Saroornagar, Telangana 500079",Hyderabad
sandeep granites and marbles,09949133441,"100 feet road, Madhapur Rd, beside bhavani weight bridge, Mega Hills, Madhapur, Hyderabad, Telangana 500081",Hyderabad
Vijaya Laxmi Marbles & Granites,09849098073,"2-5-29, Pillar No 183, Uppar Pally, Attapur, Ambience Fort, Radha Krishna Nagar, Telangana 500048",Hyderabad
Silpa marble & Granites,09573283594,"8-1-298/84, Opposite:Oasis school, Dwaraka Nagar Colony, KLM Villa, Shaikpet, Hyderabad, Telangana 500104",Hyderabad
SV GRANITES,09885383976,"Sy No. 163, Dream view Colony, Plot 81, Calvary Temple Rd, near Miyapur Metro Station, IDPl Employees Colony, Hafeezpet, Hyderabad, Telangana 500049",Hyderabad
Balaji Granites,09849037920,"Plot No.22, Nagole Ring Road Road Numbe 2, Saroor Nagar Rd, Nagole, Hyderabad, Telangana 500102",Hyderabad
Shree Hyderabad marbles and granite,07095959570,"Sy no.46 bairamalguda, opp. himabindu hospital, Hyderabad, Telangana 500079",Hyderabad
New sanju marbles and granites,08432385383,"Shiva Shakthi Nagar, Telephone Colony, Chengicherla, Hyderabad, Telangana 500092",Hyderabad
Universal Exclusive stone gallery,06309718291,"plot no.49, opp. TKR kaman, Defence Scientists Co-Operative Housing Society, Kharmanghat, Hyderabad, Telangana 500079",Hyderabad
ASAS Marbles & Granites,07075887007,"Wadi e Mahmood, Ashok Vihar Society, Hyderabad, Upperpally, Telangana 500048",Hyderabad
B.L Shri Shyam Granites & Marbles..,09032217324,"FCRQ+R32, Chenna Reddy Nagar, Ranga Reddy Nagar, Balanagar, Hyderabad, Telangana 500037",Hyderabad
Ace Marble & Granite,09912905621,"near Bhagyanagar colony, SBI Officers Colony, Sri Vivekananda Nagar, Madhapur, Hyderabad, Telangana 500081",Hyderabad
Madhusudan Granites,09246881364,"Shop No. 4-8-149/2/1,Pillar No. 156, Hyderguda, Ambience Fort, Telangana 500048",Hyderabad
Helios Stone - Imported marble - Quartz - Exotics - Granite,08886777709,"Survey no, 672 & 673, Shamshabad, Hyderabad, Telangana 501218",Hyderabad
HITEX GRANITES,09951722055,"G842+XQV, beside DBS BANK RC PURAM, adjacent to Toyota service centre, Ushkebhavi, Ramachandrapuram, Hyderabad, Telangana 502032",Hyderabad
IZZAH STONES GRANITE TILES( WHOLESALE & RETAIL),09666657169,"Bowrampet kaman circle, gandimisamma, circle, opposite Indira Gandhi statue, Bowrampet, kaman, Hyderabad, Telangana 500043",Hyderabad
Sri Balaji Granite & Marble,09700831708,"63MV P88, Hyderabad Rd, near by Tea time & indian oil pump, Chevella, Telangana 501503",Hyderabad
Granite and Italian and tiles work and repairing,07014145013,"plot no 105, Visalandhra Colony, Sai Nagar, Chanakyapuri, Hyderabad, Telangana 500068",Hyderabad
NAVKAR GRANITE,07891095379,"Plot no 9 sy.No. 112, Inner Ring Rd, Nagole, Hyderabad, Telangana 500068",Hyderabad
"Stone Hub - Tiles, Granite & Quartz",09533043015,"Sy No 434, 436, GCW3+W2F, Bowrampet Rd, opposite KLH University, Bachupally, Gandimaismma, Hyderabad, Telangana 500043",Hyderabad
Tirupati Granite & Marbles,09360886584,"opp. solitaire global school, katedan, Hyderabad, Telangana 500077",Hyderabad
Sri Vedha Stones,09440719958,"plot no 462, Prasanth Nagar, Miyapur, Hyderabad, Telangana 500049",Hyderabad
BANSAL GRANITE AND STONES,09849093900,"Block No. 1, Plot No. 67, Mathrusree Nagar, Bollaram Industrial Area, Miyapur, Hyderabad, Telangana 500118",Hyderabad
Royal Marbles Granite's and Tiles,09676777311,"Dwarakpuri colony, Machabollaram, Hyderabad, Telangana 500010",Hyderabad
Sri Kanaka Durga Granite & Nano White,09959849289,"Gate No. 1, Metro pillar No. 615, Miyapur Rd, Mathrusree Nagar, Hafeezpet, Miyapur, Telangana 500049",Hyderabad
Ramdev Baba Granites & Marbles,08686874619,"Pillar No. 204, Upparpally, Rajendranagar mandal, Hyderabad, Telangana 500048",Hyderabad
Merge Stones,04048566126,"Plot No, 271, Road No. 12, MLA Colony, Banjara Hills, Hyderabad, Telangana 500028",Hyderabad
GRACE GRANITE,09948777709,"Dammaiguda Rd, Sai Priya Colony, Kapra, Hyderabad, Secunderabad, Telangana 500103",Hyderabad
Rina Granite and Marble,09000153902,"Flat no 202, abhiteja residency, Shirdi Sai St, Kondapur, Sri Ram Nagar, Prashant Nagar Colony, Gachibowli, Kothaguda, Hyderabad, Telangana 500084",Hyderabad
Manish Marble and Granite Supplier,09030972117,"FJR6+5PQ, Kundanpally, Secunderabad, Telangana 500083",Hyderabad
BHAVANI GRANITES AND MARBLES,09440459373,"Suraram Village Rd, near hatsun milk diary, Suraram Village, Suraram, Hyderabad, Telangana 500055",Hyderabad
Hyderabad tiles granite work contractor,08335813897,"Aditya Nagar, Hafeezpet, Hyderabad, Telangana 500049",Hyderabad
Chakkilam Residency,04027766556,"2floor flat 101, Chakkilam Residency, 1-11-220/1, Gurumurthy Ln, Begumpet, Hyderabad, Telangana 500016",Hyderabad
Sri vigneshwara granite and marbles,09494445404,"HC4J+HX6, Sundar Rao Nagar, Suraram, Hyderabad, Telangana 500043",Hyderabad
Shree chamunda granite,09311727672,"Uppal Plot no.178/f hmda Saraswati colony, main road, Uppal, Hyderabad, Telangana 500039",Hyderabad
Nika Poly Granite 'N' Marble Sheets,09885018573,"H, x roads, Savarkar Nagar, Baba Nagar, Nacharam, Hyderabad, Secunderabad, Telangana 500076",Hyderabad
Sri Kiran Granite and Marbles,08179049886,"Plot No 40A, and 40B, Model Colony, Lakshmi Nagar, Nagaram, Hyderabad, Secunderabad, Telangana 500083",Hyderabad
Diamond Marble & Granite,09966464766,"Chengicherla Rd, VSSD Nagar, Telephone Colony, Chengicherla, Secunderabad, Hyderabad, Telangana 500092",Hyderabad
Ravileela Granites,04023413733,"CFG3+PP3, Durga Nagar Rd Number 2, Durga Nagar Colony, Somajiguda, Hyderabad, Telangana 500082",Hyderabad
Sri Krishna Marbles and granite Suraram,06350421679,"Medak Rd, Sundar Rao Nagar, Suraram, Hyderabad, Telangana 500055",Hyderabad
Indian Granite Marbles & Traders,09182506849,"Maha Nagar Colony, Plot No 78, Shamshabad - Mamidipally Rd, Shamshabad, Hyderabad, Telangana 501218",Hyderabad
Lamba Rock World,09145004000,"Plot 136, Mathrusree Nagar, Hafeezpet, Miyapur, Hyderabad, Telangana 500050",Hyderabad
SHREE GANAPATHI MARBLE & GRANITE,08106569392,"bangaru maisamma temple, near Y.S REDDY MOTORS, Gandi Maisamma, Hyderabad, Telangana 500043",Hyderabad
Maharaja Tiles and Granite,09000017019,"Shop no 16, shakti complex, Suraram x road, opp. mallareddy narayana hospital, Sundar Rao Nagar, Suraram, Hyderabad, Telangana 500055",Hyderabad
Sri Ambika,09391195566,"Usha Mullapudi Rd, Kailash Hills, Mahadevpur Colony, Hyderabad, Telangana 500117",Hyderabad
ST Sri Vaishnavi Traders Marble & Granite,09848274592,"GCFG+7G9, Prakasham Panthulu Nagar, Rodamestri Nagar, Hyderabad, Telangana 500055",Hyderabad
Sravanthi Marble & Granite,09866712626,"opp. BK Enclave, Krishnaja Hills, Miyapur, Hyderabad, Telangana 500049",Hyderabad
Charitha Marble Centre,09177878909,"Metro Water Works Rd, IDPl Employees Colony, Hafeezpet, Hyderabad, Telangana 500049",Hyderabad
Nature tiles and granite,09392292991,"Kennedy High School, Bollaram Rd, ASR Brundhavan Colony, Whisper Valley, Hyderabad, Telangana 500118",Hyderabad
Sri Vishnu marble and granite,08688742465,"main arc, Plot no 144, Mathrusree Nagar, Hafeezpet, Miyapur, Hyderabad, Telangana 500049",Hyderabad
Shri Balaji Marble & Granite,07742497473,"Voltana Complex, Shirdi Sai Nagar, Gautam Nagar, Balanagar, Hyderabad, Telangana 500042",Hyderabad
"majisa granite,marbal",07416023444,"5, Inner Ring Rd, New Nagole, Snehapuri Colony, Kothapet, Hyderabad, Telangana 500102",Hyderabad
Select Marble & Granite Works,09908107458,"9FJF+XX4, Nizam Shahi Rd, Beside Registration Offices, Mozamjahi Market, Herza Estate, Malakunta, Feelkhana, Hyderabad, Telangana 500001",Hyderabad
Metro Granite and Marble Works,04024732143,"Herza Estate, Malakunta, Feelkhana, Hyderabad, Telangana 500001",Hyderabad
My Home Tiles & Granites | GC Cera Tiles | Regency Tiles | AGL Tiles & Quartz | Adhesives | Apoxy Grout,06302069334,"My Home Tiles And Granites, Shankarpalli Rd, Mokila, Hyderabad, Telangana 501503",Hyderabad
Hitech marble and granite,09985006256,"Pillar no, 248 attapur, 2-6-10-126, B lane, opposite to PV Narasimha Rao Expressway, Golden City Colony, Suleman Nagar, Chintalmet, Hyderabad, Telangana 500052",Hyderabad
Sunshine Laser & Granite Works,09849892488,"Plot No: 25, 73, Gajularamaram Rd, opp. CMR School, HAL Colony, Jeedimetla, Hyderabad, Telangana 500055",Hyderabad
Triveni Grani Marmo - Tile Store in Shivrampally Attapur,09177412412,"Pillar No.263, opp. to Best Price ( Walmart, Indira Nagar Colony, Attapur, Shivarampally Jagir, Hyderabad, Telangana 500052",Hyderabad
Hudda Marble & Granite,09866122387,"Hyderabad - Warangal Hwy, near MJR Square Cinema's, Narepally, Hyderabad, Telangana 500088",Hyderabad
FIVE STAR GRANITES &MARBLES,09772737417,"next to Sri Bhavani Agencies, Shiva Shakthi Nagar, Chengicherla, Secunderabad, Hyderabad, Telangana 500092",Hyderabad
"Guru kripa Granites, Marbles And Tiles",09963261662,"Survey no.57, near mahakali temple yallamma Banda, 1st Phase Allwyn Colony, Bhagya Nagar Colony, Kukatpally, Hyderabad, Telangana 500072",Hyderabad
Vijay granites,09701322322,"Plot no 90, cs nagar, near Saket Towers, Kapra, Hyderabad, Telangana 500103",Hyderabad
Ramasethu tiles and granites,09908373570,"8JQC+CXV, Rd Number 1, Shivshankar Nagar, Kuntloor, Hyderabad, Telangana 501505",Hyderabad
Raj Granites & Marbles,09246361764,"No. 13-6-824/A, Pillar No. 102, Near Ring Road, Fort Rd, Bapu Nagar, Langar Houz, Hyderabad, Telangana 500008",Hyderabad
RAJ MARBLES & GRANITES,09398528305,"6-9-141/5&6, Survey No.17, Opposite to Pillar No.273 Dist. R.R, Katedan, Shivrampalli Village, Hyderabad, Telangana 500052",Hyderabad
Aditya Granite World,09849436185,"H. No. 7-1-385 Padmakshi Temple Road Opposite Sri Vikas Junior College, Near New Shyampet Bus Stage, Meerpet, Hanamkonda, Telangana 506001",Warangal
Devi Stones Marbles & Granite,09494113233,"Sri Sai Nagar Colony, Shyampet, Hanamkonda, Telangana 506001",Warangal
Monika marble and granite,09785379484,"XHPC+QH2, Sri Sai Nagar Colony, Shyampet, Warangal, Hanamkonda, Telangana 506001",Warangal
SAPTAGIRI STONE MART,09908539438,"23-6-73/4, Hunter Rd, New Shyampet, Shyampet, Warangal, Hanamkonda, Telangana 506001",Warangal
Shivani marbles and granites,07670873611,"XHR6+F78, Shyampet, Hanamkonda, Telangana 506001",Warangal
"Lepakshi Granites,Warangal,Telangana",09849744675,"XHXP+QGV, Nizampura, Warangal, Telangana 506007",Warangal
K.G.N STONE TRADERS.,09849145008,"OPPSITE TO KAKTIYA PHYSIOTHERAPY COLLEGE, 23-6-80/9, Hunter Rd, Sri Sai Nagar Colony, Shyampet, Hanamkonda, Telangana 506001",Warangal
"SAINADH MARBLES & GRANITES WHOLESALER HNK, WGL.",08106273554,"New Shyampet, Shyampet, Hanamkonda, Telangana 506001",Warangal
Raghavendra marbles Granites,09177415249,"church, Door No:31-3-1855,Sy No.35,opp:sri Balaji junior college,Near:Waddepally, 100 Feet Rd, NGOs Colony, NGOs Colony Phase III, Saptagiri Colony, Hanamkonda, Telangana 506370",Warangal
Teja marbles and granites,07032887475,"Hunter Rd, near HP petrol pump, Shyampet, Warangal, Hanamkonda, Telangana 506001",Warangal
Indian marble and granite,07780155138,"Hunter Rd, beside Skoda Showroom, Shyampet, Hanamkonda, Telangana 506001",Warangal
Sri mallikarjuna poly granites sheets,09515702965,"XJ32+64X, NH563, Shambunipet, Warangal, Telangana 506005",Warangal
Ram Stones,09772427777,"IP Madikonda, Plot No.141 & 144 & Sy No.1592 & 1533, Madikonda(V, Kazipet, Hanumakonda, Telangana 506142",Warangal
TELANGANA MARBLE & TILES,07097343399,"Khammam Bypass Rd, Urus Bodrai, Warangal, Telangana 506001",Warangal
EDR &ESR building material suppliers Warangal,09701194560,"Reddy Colony, Hanamkonda, Telangana 506001",Warangal
Mayuri Ceramics,09848544254,"Shop Number- 12, 8-101, Hunter Rd, Ramannapet, Warangal, Telangana 506002",Warangal
Durga Traders,08499076869,"Cross Road, NGOs Colony Phase III, Jawahar Colony, Warangal, Hanamkonda, Telangana 506370",Warangal
Kajaria Tiles Authorised Showroom - Sri Bhadrakali Tiles And Sanitary,09705053438,"D, No. 23-6-212/6, Chowrasta, Hunter Rd, Shyampet, Hanamkonda, Warangal, Telangana 506001",Warangal
BRD Marble And Granite,09414517915,"100 Feet Rd, near Nayeem Nagar, Nayeem Nagar, Lashkar Singaram, Gopalapuram, Hanamkonda, Telangana 506009",Warangal
Venkateshwara cement sanitary stores,09866649522,"Raganna Darwaja, New Raipura, Raipura, Hanamkonda, Telangana 506011",Warangal
Kajaria Tiles Authorised Showroom - Dandu Ceramic Gallery,09849326343,"Dandu Ceramic Gallery Jawahar colony KU, to, NIT road, Hanamkonda, Warangal, Telangana 506004",Warangal
JAI SAI RAM Marbles & Granites,09849682996,"XHR6+8MH, Shyampet, Hanamkonda, Telangana 506001",Warangal
YASHODA GRANITES,09811402616,"Ay no 899, Village MDI: ELkathurthy, E/A, Gopalpur Rd, Gopalapuram, Warangal, Telangana 506009",Warangal
"H & R Johnson Tiles - Hanmakonda, Warangal",08071821049,"Srikanth Ceramics, Hunter Rd, beside Zoo Park, Hanmakonda, Meerpet, Warangal, Hanamkonda, Telangana 506001",Warangal
"H & R Johnson Tiles - Sri Sai Sanitation - Best Tiles for Bathroom, Kitchen, Wall & Floor in Hanamkonda",08037907920,"Beside Reliance Digital, Plot No 511/502, Naim Nagar, Hanamkonda, Telangana 506009",Warangal
Simpolo Tiles & Bathware - Teja Tiles,08037014198,"Shop No 23, 6-80/3, Hunter Rd, opposite MG Motor Raam4Wheeler Showroom, Sri Sai Nagar Colony, Shyampet, Hanamkonda, Warangal, Telangana 506001",Warangal
Rayees Stone Traders,09849446174,"205/B, Hunter Rd, near NEXA SHOWROOM, Ramannapet, Hanamkonda, Telangana 506001",Warangal
PRM BROTHERS TRADERS,09989975566,"Manjoor Nagar, Bhupalpally, Telangana 506170",Warangal
KGN MARBLE WORLD,09951928404,"Narsampet Main Rd, Warangal, Narsampet, Telangana 506132",Warangal
Jsm granites,09849210686,"XH9J+4QH, Khammam Bypass Road, opposite AKU THOTA function hall, Warangal, Telangana 506001",Warangal
RASUL TRADERS granite,09866226969,"XGRP+QV4, Sri Sai Colony, Revenue Colony, Subedari, Hanamkonda, Telangana 506370",Warangal
Makrana granite,09782212121,"Warangal-Huzurabad Rd, Elkathurthy, Telangana 505476",Warangal
Rajasthan Marble &Granite,09866984261,"Hunter Road, circle, Shyampet, Warangal, Telangana 506001",Warangal
Triveni granites,09177415249,"100 Feet Rd, Srinagar Colony, Warangal, Hanamkonda, Telangana 506001",Warangal
Shiva Keshava Granites & Marbles,09177087781,"5-11-701/1, OPP:, KU First Gate, Hanuman Nagar, Hanamkonda, Telangana 506009",Warangal
SUNDARAM GRANITES,09680868086,"Gopalpur, Road, Elkathurthy, Telangana 505476",Warangal
Sri Hanuman Stones,09966558746,"11-1-276, 3/1, Armoor Road, Kanteshwar, Nizamabad, Telangana 503002",Nizamabad
"Jai Ganesh marbles, Granite, Tiles",07013838685,"road, Madhavanagar, Nizamabad, Telangana 503003",Nizamabad
Sri Laxmi Stones,08523047696,"H.No. 3-10-93/A, Nagaram Rd, opp. Sri Rama Rice Mill, Chandra Nagar, Nizamabad, Telangana 503001",Nizamabad
"Stone Art Studio - Granite , Quartz Stone Slab & artificial slab",09705460546,"Nizamabad - Mancherial - Jagdalpur Rd, Mubaraknagar, Nizamabad, Telangana 503003",Nizamabad
SREE RANA BAI MARBLE & GRANITE DEALERS,09887145655,"opp. vijaya public school, R T C Colony, Mubaraknagar, Nizamabad, Telangana 503003",Nizamabad
Shivam stone mart,09602081159,"Mubaraknagar, Nizamabad, Telangana 503003",Nizamabad
SHREE NARAYANI MARBELS & GRANITES,09390312181,"S No 2-6/2, opp. Vevekandha Iti, Mubaraknagar, Nizamabad, Telangana 503003",Nizamabad
SUGUNA Sanitary & Tiles (SST),07075288996,"Bypass Road, Maruti Nagar, Nizamabad, Telangana 503002",Nizamabad
Paras Constro Hub,09640007224,"Manik Bhandar, Nizamabad, Telangana 503003",Nizamabad
Kajaria Tiles Exclusive Showroom - R.K. Tile Studio,09666610567,"Armoor Rd, Mubaraknagar, Nizamabad, Telangana 503003",Nizamabad
Siddi Ganesh Tiles And Sanitary,09440892717,"11-1-1907/10/1, opp. Sri Rama Gardens, Nizamabad, Telangana 503002",Nizamabad
Laxmi Granites,09989597770,"M4R9+CXC, Maruti Nagar, Nizamabad, Telangana 503002",Nizamabad
R K TILE STUDIO,07997070123,"1, Mubaraknagar, Nizamabad, Telangana 503003",Nizamabad
Manikanta Sanitary,09701461122,"M468+8C8, Aryanagar Vinayaka Nagar Hyd Road, opp. Sub-Station, Nizamabad, Telangana 503003",Nizamabad
SNEHA TRADERS,09110780437,"S N 1, 22-4, Rd Number 3, opp. Padmanagar, Padma Nagar, Nizamabad, Telangana 503001",Nizamabad
Kajaria Eternity World Showroom,09640007224,"Paras Constro Hub pvt. ltd., 552/1/1, NH 63, Tirupathi Agro Industries Chakka Chowk, Manik Bhandar, Borgaon (Kalan), Nizamabad, Telangana 503003",Nizamabad
Jalaram Hardware,09160040960,"1-9-49, x road, Phulong, Nizamabad, Telangana 503001",Nizamabad
A.R Granite And Marble,08239990255,"Nizamabad - Mancherial - Jagdalpur Rd, Gangastan, Nizamabad, Telangana 503002",Nizamabad
Sri Rudra Granites Hub,08297001386,"S No 1-6/1 Be Side Vevekanadha Iti, Mubaraknagar, Nizamabad, Telangana 503003",Nizamabad
MR Granites,08297245201,"&, Survey No. 48/A, 49/A, Khazipur Village Karimnagar Mandel, District, Karimnagar, Telangana 505401",Karimnagar
Karimnagar Granites Supplier ( Uttam Kumar ),08637475263,"Vemulawada Road . Near Power House Asifnagar Bavupet MDL - Kothapally, Karimnagar, Telangana 505001",Karimnagar
Poorna Marbles & Granites,09989682907,"Sy.No:1349, Jagtial Rd, near Reliance Digitals, beside HP Petrol Bunk, Vivekananda Puri, Karimnagar, Telangana 505001",Karimnagar
Ssri Kameshwari Marbles & Granites,08897979792,"Jagtial Rd, near Sbi Bank, Suryanagar, Karimnagar, Telangana 505451",Karimnagar
Sri Kanakadurga Marble & Granite Traders,09347185454,"Jagtial Rd, near H.P. Gas, Chaitanyapuri, Karimnagar, Telangana 505001",Karimnagar
BABBAN STONES,09885425581,"Kashmirgadda, Karimnagar, Telangana 505001",Karimnagar
Mayank Jain- Granite Supplier (Trader) Karimnagar,07877651606,"Baopet, Karimnagar, Telangana 505401",Karimnagar
Vinayaka Granites & Marbles,09849254861,"Near RTC Workshop, Suryanagar Road, No:5, Jagtial Rd, Karimnagar, Telangana 505002",Karimnagar
SriMaheshwari Marbles & Granites,09887854223,"Near Rekurthi Bus stop Jagtial, Main Road, near Vision High School E/M, Karimganar, Karimnagar, Telangana 505451",Karimnagar
Vijayalaxmi Stones,09652385317,"beside Legend school, Shanthinagar, Bhagatnagar, Katta Rampur, Karimnagar, Telangana 505001",Karimnagar
Ganesh granite and marbles,09959205014,"opp:sridevi garden's, Surya nagar, seetharampur, Karimnagar, Telangana 505002",Karimnagar
WORLD CLASS GRANITE,09214355555,"near MARWADI TEMPLE ONE TOWN POLICE STATION, Mukarampura, Karimnagar, Telangana 505001",Karimnagar
Raam Panyala (99granites mobile App),09550499965,"Rd Number 7, Santhosh Nagar, Jyothinagar, Karimnagar, Telangana 505001",Karimnagar
Adhar devi Tiles,09963007822,"Rekurthi, Karimnagar, Telangana 505451",Karimnagar
Om Sri Mallikarjuna Marbles & Granites,09704055919,"Shop, Road No. 4, Near Rtc. Work, Jagtial Rd, Suryanagar, Karimnagar, Telangana 505002",Karimnagar
Raja Rajeswara Granites & Marbles,09550567052,"F486+CPF, Jagtial - Karimnagar Rd, opp. Yamaha Show Room, Rekurthi, Karimnagar, Telangana 505451",Karimnagar
Sri Kiran Trading Company,09052079818,"Peddapalli Road, Kisan Nagar, Karimnagar, Telangana 505001",Karimnagar
Charu Rocks,08290076314,"Karimnagar, Asifnagar, Telangana 505401",Karimnagar
Sapthagiri Bricks & Tiles,09440077667,"C4H6+569, Shiva Nagar, Karimnagar, Telangana 505001",Karimnagar
Mahaveer granite,09929099266,"C2F8+4Q3, Karimnagar, Asifnagar, Telangana 505401",Karimnagar
Bhavani Engineers,09299955556,"7-46/2/2/A, TRK Nagar, Karimnagar, Telangana 505001",Karimnagar
Kajaria Tiles Authorised Showroom - Sri Laxmi Narsimha Traders,09441129417,"Sai Tower, opp. Chemist Bhavan, Jyothinagar, Karimnagar, Telangana 505001",Karimnagar
Rahul Arts Granite & Photo Engraving Works,09502006189,"shop no. 1Mukarampura, Telangana Chowk, Jyothinagar, Karimnagar, Telangana 505001",Karimnagar
"Rampur Cement, Steels & Sanitary",09440008880,"C4CP+M58, Ganesh Nagar Main Rd, opp. Bala Hanuman Temple, Kothirampur, Karimnagar, Telangana 505001",Karimnagar
Sri Hanuman Krupa Marble And Granite Shm,08801554747,"SHM Complex, 9-75/15/2/1, near Registation office, Stage, Thimmapur, Karimnagar, Telangana 505527",Karimnagar
TAN BROWN GRANITE,08302642625,"Industrial Area, Road No 9, Kashmirgadda, Karimnagar, Telangana 505001",Karimnagar
KARIMNAGAR GRANITES&MARBLES,08121343013,"near St.pauls school, Vavilalapally, Karimnagar, Telangana 505001",Karimnagar
Shivam Granite Karimnagar,09994367061,"Sy No. 121/B/C/2/1 Kazipur village Kothapalli (Mdl, Telangana 505401",Karimnagar
99granites,09550499965,"SYNO 176AB WADYARAM, GANGADHARA MANDAL, Karimnagar, Telangana 505401",Karimnagar
K.E.S& COMPANY,09985555807,"Unnamed Road, Pochamma Wada, Karimnagar, Telangana 505001",Karimnagar
Fine Marble And Polish Stones - Best Stones Supplier In Karimnagar,07073737446,"Old Labor Adda Rd, beside HP Petrol Bunk, opposite Kamala Nirmala Residency, Jyothinagar, Karimnagar, Telangana 505001",Karimnagar
M/s. K R Granites,08782264999,"9-1-211/4, 60 feet lane, Bhagatnagar, Mukarampura, Karimnagar, Telangana 505001",Karimnagar
SMS GRANITES,09440474246,"C2G5+H4X, Baopet, Asifnagar, Telangana 505401",Karimnagar
Mahanidhi Granites,07976102030,"Karimnagar, Asifnagar, Telangana 505401",Karimnagar
PSR Granites,04023411332,"Jyothinagar, Karimnagar, Telangana 505001",Karimnagar
Meenakshi Stonex,09673606665,"Alugunur, Telangana 505527",Karimnagar
Jayalakshmi Granites,09346358717,"Sy No: 317, ASIFNAGAR, KOTHAPALLY(M), KARIMNAGAR, Telangana 505401",Karimnagar
Shree Balaji Stonex,09988545881,"BAVPET'KOTHAPALLY Ayilonipally, Sy.no. 330/B, KHAZIPUR, Kalvakunta - Kazipur Rd, Baopet, Telangana 505401",Karimnagar
Shree Ganga Granites,09982791034,"near Urban mart, Baopet, Karimnagar, Telangana 505401",Karimnagar
"SIDDHI VINAYAK STONEX, KARIMNAGAR",07239851000,"Sy no. 338, kothapalli, Kazipur, Telangana 505401",Karimnagar
Sreevaree Stonexa,08501992200,"Sy no. 264A/2, kothapalli mandal, Baddipalli, Karimnagar, Telangana 505451",Karimnagar
GRANITE CITY Karimnagar,09828166066,"Sirchilla, Karimnagar Rd, Odyaram, Vill, Gangadhara, Telangana 505524",Karimnagar
salasar granites,09885094893,"Asifnagar, Telangana 505401",Karimnagar
LOVELY GRANITE,07413897311,"Baopet, Asifnagar, Telangana 505401",Karimnagar
Ceemat,09640000021,"Kothapally Mandal 121/B/C/2/2, Kazipur, Telangana 505401",Karimnagar
SHREE VEER TEJA GRANITES,08790455213,"Sy.no.274,near shri rama weigh bridge Bavupet, Baopet, Telangana 505401",Karimnagar
Tirumala Stonex,09885252911,"C567+C5H, Karimnagar, Telangana 505469",Karimnagar
Venu arts Granite & Steel Engraving Works,09849785938,"C4MG+355, Mukarampura, Karimnagar, Telangana 505001",Karimnagar
Ramdev baba granite and interiors,06302221674,"Khanapuram haveli, Ida, Khammam, Telangana 507002",Khammam
"RAMDEV BABA GRANITES AND MARBLES, BALLEPALLY",06302051923,"8-2-49/6, Khanapuram Industrial Area, Khanapuram, Khanapuram Haveli, Khammam, Telangana 507002",Khammam
RAMDEV BABA GRANITES AND MARBLES,09440100190,"plot no.16 bypass road, near n.t.r circle, Khammam, Telangana 507002",Khammam
Shree radhey marbles and granite khammam,09376700177,"753C+749, Indira Nagar Colony, Khanapuram Haveli, Khammam, Telangana 507002",Khammam
