store_name,contact_number,address,city
Orientbell Tiles Boutique - Shri Gobind marble,09167081678,"Rewa Rd, near Mai Sthan, Patahi Jagganath, Muzaffarpur, Patahin, Bihar 843113",Muzaffarpur
Bajrang Traders Tiles & Marble,08210687633,"Rupanpatti chowk, NH 28, Muzaffarpur, Bishanpur Baghnagari, Bihar 843105",Muzaffarpur
Orientbell Tiles Store - Metha Hardware Stores,18002081015,"Beside Jubba Sahni Park, Club Rd, Rawna, Mithanpura, Muzaffarpur, Bihar 842002",Muzaffarpur
Kailashi Hardware & sanatri weare,06200743053,"Chandwara, Muzaffarpur, Bihar 842001",Muzaffarpur
SHIV SHAKTI TILES GRANITE AND SANITARY,09661011606,"Shop No 1, Naya Chowk, Muzaffarpur-Deoria Rd, near by Hp Petrol Pump, Barkagaon North, Muzaffarpur, Bihar 843109",Muzaffarpur
Laxmi marble,09430075899,"NH-22, chandrahatti near Manisha polusion center Hajipur muzaffarpur road Near s b I Bank chandrahatti, Kurhani, Bihar 844120",Muzaffarpur
Baba Ramdev Rajasthan Marble and Granite,09065063096,"Near RadhaHari hero agency, Sipahpur, Darbhanga Road, Ahiyapur, Bihar 842001",Muzaffarpur
Alfa Ceramics,09576211326,"Murtuza Complex, Jail Rd, Chandwara, Muzaffarpur, Bihar 842001",Muzaffarpur
RAJ MARBLE,08084596878,"Anuradha complex Ziro Mile Road NR Dadarpul, Muzaffarpur, Bihar 842001",Muzaffarpur
Shree Sankat Mochan Balaji marble,09572405823,"chowk, near Hanuman mandir, Markan, Muzaffarpur, Bihar 843119",Muzaffarpur
Maa Janki Marble,07250091893,"Basant Bihar Colony, Heeranagar colony, Kolhua Chowk, Paigamber Pur Kolhua, Bihar 843108",Muzaffarpur
Shree Shree Marble And Granite,09649619559,"49X8+RJW, near M.R.F Showroom, Saraswati Nagar, Bairia, Muzaffarpur, Bihar 842003",Muzaffarpur
Vishwnath marble,07765886916,"Sakichan Ghat Rd, Jogsar, Adampur, Bhagalpur, Darabpur, Bihar 812002",Bhagalpur
TILES HOUSE (Rajasthan Wale),08112262878,"Near, Swami Vivekanand Rd, Jogsar, Goshalla, Thana, Bhagalpur, Bihar 812001",Bhagalpur
S. K Marble,09973061675,"S v path infront of jogsar thana, Adampur, Bhagalpur, Bihar 812001",Bhagalpur
Shri Rana marble and granite,09667747426,"road, near makrana marble, Zero Mile, Sabour, Bhagalpur, Bihar 813210",Bhagalpur
Kajaria Tiles Authorised Showroom - Raj Marble House,07278390611,"Raj Kumar Sah, Bhagalpur Institute DN Singh Road, Swami Vivekanand Path, Sadruddin Chak Rd, Masak, Bhagalpur, Bihar 812002",Bhagalpur
Hindustan Marbles Branch 2,08271743494,"kajwalichak, Tatarpur Rd, Bhagalpur, Bihar 812002",Bhagalpur
HEALER marble - Somany Tiles - Arbo Bathware,08334849619,"Tatarpur Rd, opposite ICICI BANK, Urdu Bazar, Bhagalpur, Bihar 812002",Bhagalpur
Bhagalpur Tiles Center,09534767741,"723F+FH7, Zero Mile, National Highway - 80, Bahadurpur, Bhagalpur, Bihar 813210",Bhagalpur
Radiant tiles showroom,08092400396,"Angari, Sarmaspur, Bhagalpur, Bihar 813210",Bhagalpur
Ashiyana Marble,09097669119,"Nawab house, Tatarpur Rd, near rai marble kaziwalichak, Bhagalpur, Bihar 812002",Bhagalpur
Raj & Raj Marble,09801612197,"Quaziwali Chak, Tatarpur Rd, Laheari Tola, Urdu Bazar, Bhagalpur, Bihar 812002",Bhagalpur
Nirala Arts & Advertiser,09771593083,"Radha Rani Sinha Rd, Adampur, Bhagalpur, Bihar 812001",Bhagalpur
Rahman Granite,09834516549,"Rahman Greanite, Bhagalpur, Jamni, Bihar 812005",Bhagalpur
SUNNY TILES,09631247576,"Tilkamanjhi - Champanagar Rd, Sahibganj, Bhagalpur, Bihar 812002",Bhagalpur
Orientbell Tiles Boutique,01206027740,"Hotel Nihar Complex, Kachahari Chowk, Adampur, Bhagalpur, Bihar 812001",Bhagalpur
Pushkar Hardware,09472502555,"6XMF+PCG, Bausi Road, Bhagalpur, Bihar 812001",Bhagalpur
"H & R Johnson - Adampur, Bhagalpur",08071265392,"Jagdambey Marble, Red Cross Rd, nearby Registry Office, Adampur, Bhagalpur, Bihar 812001",Bhagalpur
Saanvi Tiles,07004890325,"Bounsi Rd, near Sbi Atm, Tilkamanjhi, Bhagalpur, Bihar 812001",Bhagalpur
Maa Bhawani Tiles,09771273015,"Gudatta Chowk, Bounsi Road, Bhagalpur, Bihar 812001",Bhagalpur
Shree Shyam Tiles - The Design Hub,07829721209,"Poonam Cinema Road, Shree Shyam Kalyankunj Apartment, opposite HDFC Bank, Darbhanga, Bihar 846004",Darbhanga
H & R Johnson - Gupta Marble And Sanitary,08071265387,"Gupta Complex, nearby Punjab & Sind Bank, Donar, Darbhanga, Bihar 846003",Darbhanga
Navkar Tiles & Sanitary,09909111154,"Kakarghati, NH-57, East-West Expy, Darbhanga, Bihar 847115",Darbhanga
Bajrang Tiles & Sanitary,08340777243,"Ganesh Mandir, near, Tower Chowk, Hassan Chak, Bada Bazar, Lal Bagh, Darbhanga, Bihar 846004",Darbhanga
Bam Bam Tiles,09304763543,"Bam Bam Tiles, NH57, Gehumi, near Maa Bhagwati Dharam Kanta, Darbhanga, Bihar 846005",Darbhanga
ANGIKA TILES AND PLUMBAR,08676809708,"SH 56, Donar, Darbhanga, Kabir Chak, Bihar 846009",Darbhanga
Kajaria Tiles Authorised Showroom - Shree Shyam Sanitary,07979803519,"Chowk, Station Road, in front of Church, Donar, Darbhanga, Bihar 846004",Darbhanga
Kajaria Tiles Exclusive Showroom - Sidhi Vinayak,09334004968,"Subhash Chowk, near SBI City Branch, Bada Bazar, Lal Bagh, Darbhanga, Bihar 846004",Darbhanga
CERAMIC CENTRE,07667436572,"OFF. S.H-56, NEAR SANJIVANI HP PETROL PUMP, KABIR CHAK, Darbhanga, Bihar 846009",Darbhanga
New Vijay Hardware,08540971588,"005 GN Ganj Near Punjab National Bank Ward No 41, Laheriasarai, Road, G N Gunj, Darbhanga, Bihar 846001",Darbhanga
Ornate Interiorz,09934656192,"4VMV+3JW, Karamganj , Laheriasaria, Darbhanga, Bihar 846001",Darbhanga
H & R Johnson - Sidhi Vinayak,08071265409,"Prince Market, Subhash Chowk, nearby SBI Bank, Shivaji Nagar, Gullowara, Darbhanga, Bihar 846004",Darbhanga
Quality Marbles Granites,09939346988,"4VGW+V2V, Corporation Bank Building, near Light House, Belwaganj, Laheriasarai, Darbhanga, Bihar 846001",Darbhanga
Darbhanga Tiles,07654601530,"Gehumi Shivdhara, near D.P.S, Gahumi, Darbhanga, Bihar 846004",Darbhanga
Shyam Baba Tiles,09430494380,"Naka no.2, Balughat Rd, Kedirabadh, Mansaar Colony, Darbhanga, Bihar 846004",Darbhanga
Mithila Marble House,09546300209,"Mithila Marble house,near singhwara Thana( police station, Singhwara, Bihar 847123",Darbhanga
RAHUL TRADERS,09973740861,"ganj Chowk, near Hanuman Mandir, Ubg, Kabir Chak, Darbhanga, Bihar 846009",Darbhanga
Nandani Marbles Agency-Marbel |Tiles| Granite Showroom in Purnia,07781872904,"Polytechnic Chowk, NH31, Maranga, Purnia, Bihar 854303",Purnia
Maa Shyama Marble,06454243899,"Barauni - Purnea Hwy, Maranga, Purnia, Bihar 854303",Purnia
Aravali Marbles,07654002202,"Barauni - Purnea Hwy, Maranga, Purnia, Bihar 854303",Purnia
"R.K. Marbles & Tiles , the exclusive oasis tiles showroom",07004007690,"R K Marbles & Tiles, Subhash Nagar, Purnia, Bihar 854303",Purnia
M/S NEHA GRANITES & MARBLES,08210378911,"Madhubani, Purnia, Bihar 854301",Purnia
Ganpati Granite & Marbles,08051455718,"QFCF+22G, Gurudwara Road, Ambedkar Market, Purnia, Bihar 854301",Purnia
Niraj Marble & Tiles,08757233574,"Niraj Marble & Tiles, Bhatta Bazar Lakhan Chowk Rd, Naya Tola, Purnia, Bihar 854301",Purnia
Ramdev Ceramic,09510898563,"NH-31, BYPAAS ROAD, near RADHA KRISHNA MANDIR, opposite SAFEXPRESS, UFRAIL CHOWK, Purnia, Bihar 854303",Purnia
CERA TILES Turai Traders,09661398888,"Majeed Complex, near Brajesh Automobile Mahindra Showroom, Maranga, Purnia, Bihar 854303",Purnia
Hindustan Tiles & sanitary,09939814673,"Gumati No. 03 Bibiganj Pul, Purnea - Srinagar Rd, Janta Chowk, Purnia, Bihar 854304",Purnia
Kajaria Tiles Authorised Showroom - Maa Kamakhya Trading,09934642400,"Infront of Hanuman Mandir, NH31, Maranga, Purnia, Bihar 854303",Purnia
Shree Shyam Marble Evam Granite,07250352890,"Near Rail Gate- 13, Belouri, Sanouli Road, Purnia, Bihar 854326",Purnia
"H & R Johnson - Sarvoday Nagar, Purnia",08037537674,"Shree Hanuman Agency, Taxi Stand, Chitrawani Rd, nearby Aitiana Garage, Sarvoday Nagar, Purnia, Bihar 854301",Purnia
Shakti Marbel & Granite,07541962620,"NH31, Poly Technic Chowk, Ram Nagar, Maranga, Purnia, Bihar 854303",Purnia
Maa Durga Tiles & Marbles,09709446644,"Barauni - Purnea Hwy, Vasant Vihar, Begusarai, Harrakh, Bihar 851101",Begusarai
Sri Hanuman Tiles & Sanitary,07546033332,"SUBASH CHOWK, near MAHINDRA TRACTOR SHOW ROOM, Bihar 851101",Begusarai
Vikash Traders,08862816960,"Near G.S. Motor, N.H . 31 Har Har Mahadev Chowk, Begusarai, Bihar 851101",Begusarai
"H & R Johnson - Vasant Vihar, Begusarai",08037537673,"Piller No 74, NH 31, Gupta Hardware, Power House Chowk, opposite PWD Office, Vasant Vihar, Begusarai, Bihar 851101",Begusarai
H & R Johnson - India Cement Product,08071265391,"Ward No 22, Chakki Road, nearby Sri Ram Mandir, Ratanpur, Alaudipur, Begusarai, Bihar 851101",Begusarai
Kajaria Tiles Exclusive Showroom - Taj Mahal Sangmarmar,09430419163,"Taj Mahal Sangmarmar, GD College Rd, Mirganj, Begusarai, Barauni IOC Twp, Bihar 851101",Begusarai
Orientbell Tiles Boutique - Vikas Traders,09167443873,"Ward No 13 NH 12, Har har mahadev chowk, Kapasiya, Begusarai, Bihar 851117",Begusarai
New mahavir steel trading,09431203420,"opposite to D.C singh petro pump, subhash chowk, Begusarai, Bihar 851101",Begusarai
RTM AGENCY GUJARAT TILES,09898876044,"B.B. Complex, NH 31, near Gyan Bharti School, Kaushal Colony, Kapasiya, Begusarai, Barauni IOC Twp, Bihar 851101",Begusarai
Kajaria Tiles - TCSR,08919400874,"Nimtala road, near rajiv gandhi Chowk, Shankarpur, Munger, Bihar 811201",Munger
Radhe Radhe Marble House,09942222486,"Munger Road, Daulatpur, Jamalpur, Bihar 800001",Munger
Ashish Marble Kajaria Show Room,09576563000,"Mahadeva Road, Mahavir Tola, Mahajan Toli, Arrah, Bihar 802301",Arrah
Radhe Radhe Tiles & Sanitaryware,08235920006,"Jagdev Road, Jagdev Nagar, Arrah, Bihar 802302",Arrah
Ganpat Jee Keshri & Son's Ashish Marble,09472987534,"no.1, Mahadeva Road, Mahajan Toli, Arrah, Bihar 802301",Arrah
Bharat Marble & Tiles,07479925681,"Ara - Sasaram Road, Zero Mile, Arrah, Bihar 802302",Arrah
Kajaria Tiles Exclusive Showroom - Ganpat Jee Keshri & Sons Ashish Marble,09308570370,"No.1, Mahadeva Road, Mahajan Toli, Arrah, Bihar 802301",Arrah
H & R Johnson - Maruti Traders,08037221023,"Barahara Road, nearby PNB Bank, Vijay Nagar, Arrah, Bihar 802301",Arrah
Shree shyam granites marble and tiles,09983164721,"gate number 1, केंद्रीय विद्यायल के सामने, opposite side of JMD palace, सासाराम रोड, near power grid, Arrah, Ekawana, Bihar 802210",Arrah
"Shivam Tiles and Hardware, Sasaram",09873116515,"Sasaram-Tilauthu Road, Grand Trunk Rd, near Rohtas Diesel and Sudershan Honda Service Centre, Dilia, Sasaram, Bihar 821115",Sasaram
Shree Balaji Marble & Granites,09887511374,"Mahmoodpur Naibasti, Chandhasi, Mughalsarai, Sasaram, Uttar Pradesh 821113",Sasaram
NITCO(Maurya Tiles & Sanitary),09661453724,"Maurya Nagar, Mico, Grand Trunk Rd, Dilia, Sasaram, Bihar 821115",Sasaram
Patel tiles,08789223473,"Gaurakshni, opposite of durga mandir, beside Central Bank of India atm, Mohaddiganj, Sasaram, Bihar 821115",Sasaram
AMAR PUMPS AND HARDWARE,09504455776,"Sasaram-Tilauthu Rd, near Kushwaha Bhawan, Sasaram, Bihar 821115",Sasaram
Shri Ram tiles and marbles,09023464018,"more, Beda, Grand Trunk Rd, balathua, Sasaram, Bihar 821113",Sasaram
"H & R Johnson Tiles - Jannat Tiles & Marble House - Best Tiles for Bathroom, Kitchen, Wall & Floor in Mukti Path",08037908042,"Pali Road, Mukti Path, Near, Pali Bridge, Dehri, Bihar 821307",Sasaram
Tiles Emporium,09572207613,"Road, Chaurasia Chowk, Mahatma Gandhi Setu, Hajipur, Bihar 844102",Hajipur
Kajaria Tiles Exclusive Showroom - Muskan Marble,09473224786,"Muskan Marble Dakbanglo Road, Chowk, near Anwarpur, Hajipur, Bihar 844101",Hajipur
Rajasthan Marbles,08083216681,"Rajasthan Marbles, Paswan Chol, Bihar 844101",Hajipur
SRI BALAJI MARBLE AND GRANITE,08578007000,"Bypass Rd, Bagmusa, Hajipur, Naurangabad, Bihar 844101",Hajipur
APURBA MARBLE,09835082072,"New bypass road, Anjaanpeer Chowk, Hajipur, Bihar 844103",Hajipur
Orientbell Tiles Store - Vijay Hardware,01206027740,"Ground Floor, Baghdulhan, Hajipur, Bihar 844101",Hajipur
Panna Asbestas & Geetanjali Marble,08540832288,"main by pass, Sandha Mathiya, Prabhunath Nagar, Chapra, Bihar 841301",Chapra
KGN Marble,09576323200,"QPJQ+28V, Dak Bunglow Rd, Sadhapur, Chapra, Mukrera, Bihar 841301",Chapra
Ganesh Marbal,09155790964,"Shayam chak, Thana Bhaggwan Bazar, near kumhar toli, Chapra, Bihar 841301",Chapra
Singh Marble & Granite And (Tiles),07004181216,"over bridge, beside Rishu traders, Mahamda, Mehian, Bihar 841302",Chapra
H & R Johnson - Bhawani Tiles,08071265383,"Rewa-Muzaffarpur Road, nearby Banshakti Devi maa Mandir, Newaji Tola, Chapra, Bihar, 841301",Chapra
"Taj Marble(Tiles, Marble and Sanitaryware Dealer)",07070553388,"Makhdoom Sarai Road, Babunia Rd, Mode, Siwan, Bihar 841226",Siwan
Palak Marble,09525597922,"69PF+4RV, Bindushar Bujurg, Barhariya Road, near Cement Godam, Siwan, Bihar 841227",Siwan
Sita Ram Marbles,07070563955,"SITARAM CHOWK, Chapra - Gopalganj Rd, near Dr. P Devi, Pal Nagar, Siwan, Atarsua, Bihar 841227",Siwan
Ganesh Marbles & Tiles,09661686633,"Mauli Ke Bathan, Sitaram chowk, Chapra - Gopalganj Rd, Rajendra Path, Siwan, Bihar 841226",Siwan
Royal Tiles and Marble,09304316199,"Adda no 2, Babunia Rd, Siswan Tola, Siwan, Bihar 841226",Siwan
Kajaria Tiles Authorised Showroom - Ganesh Marble,09771356804,"Chhapra - Siwan Rd, near Bijali Office, Electric Colony, Siwan, Atarsua, Bihar 841226",Siwan
Pratap Marble (Authorised Dealer Asian Tiles ),09631296624,"NH 85, Chhapra - Siwan Rd, Siwan, Bihar 841226",Siwan
Urban Tiles & Ceramics,09507407655,"near Laxmi Nursing Hospital, Paighamber pur, Kagzi Muhalla, Siwan, Bihar 841226",Siwan
"H & R Johnson Tiles - Patliputra Traders - Best Tiles for Bathroom, Kitchen, Wall & Floor in Siwan",08037907972,"Tarwara Road, nearby Vatayan School, Electric Colony, Siwan, Atarsua, Bihar 841227",Siwan
B.k tiles,09942071405,"Siwan Byp, near by Kushwaha Chauk, Hakam, Siwan, Bihar 841227",Siwan
NATURAL TILES,07070922882,"TARWARA ROAD, Siwan, Mahpur, Bihar 841227",Siwan
Mahadev marble & Granite,09667845976,"Chapra - Gopalganj Rd, Siwan, Bihar 841226",Siwan
Himalaya Natural Stone,08149857756,"NH 28, near Chandi mandir, Shiv Nagar, Motihari, Bihar 845401",Motihari
"H & R Johnson Tiles - Ganpati Marbles - Best Tiles for Bathroom, Kitchen, Wall & Floor in Motihari",08037908035,"Ward No 12, near Durga Mandir, Dharamsamaj Chowk, Motihari, Bihar 845401",Motihari
MAA BHAGWATI MARBLE माँ भगवती मार्बल,06201052363,"JWPC+65V, Bada Bariyarpur, Motihari, Bihar 845402",Motihari
Taj Marble,08051358156,"MW39+WVJ, Bagaha Dhala Rd, Rajendra Nagar, Motihari, Bihar 845401",Motihari
Shree Ranabai Marble / Granite,09361643769,"Sanskar eye hospital main road, NH28, Chhota Bariyarpur, Motihari, Bihar 845401",Motihari
H & R Johnson - R K Marble,08071265405,"Durga Chowk, NH 28, nearby Jawa Showroom, Bada Bariyarpur, Motihari, Bihar 845402",Motihari
Orientbell Tiles Boutique - Sai Marble And Store,09619240051,"Ground Floor, Banat, near Bankat, Motihari, Bihar 845402",Motihari
Kajaria Tiles Exclusive Showroom - Buildmart,09570295734,"Ward No 2, NH 28, Janpur Chowk, Awdsess Chowk Road, Motihari, Bihar 845401",Motihari
Granite Zone | Best Granite Shop in Raipur | Best Marble Shop in Raipur,09993722067,"New Dhamtari Rd, beside Wallfort Elegant, RishabhNagar and Pawan Vihar Colony, Lalpur, Raipur, Tikrapara, Chhattisgarh 492015",Raipur
Vishwas Granite | Granite Dealer in Raipur | Marble Dealer in Raipur |,09754398000,"Ring Road No. 1, near Panchpedi Naka, Laxmi Nagar, Navjeevan Society, Pachpedi Naka, Raipur, Mathpurena, Chhattisgarh 492001",Raipur
Granite Centre India,09826467777,"Dhamtari Rd, Amrapali Society, Lalpur, Raipur, Tikrapara, Chhattisgarh 492001",Raipur
VALLEY STONE,09000044071,"Kh. No. 232/16, New Dhamtari Rd, near Chaitanya Business Park, opp. kamal vihar, Devpuri, Raipur, Chhattisgarh 492015",Raipur
Marble Palace,09617855024,"Marble Market, Ring Road No. 1, Laxmi Nagar, Durga Para, Pachpedi Naka, Raipur, Chhattisgarh 492001",Raipur
Bharat Marble And Granite,09111169665,"Service Rd, near rajdhani hospital, Laxmi Nagar, Navjeevan Society, Pachpedi Naka, Bhilai, Raipur, Chhattisgarh 492001",Raipur
Ashok Marble,09713211555,"Marble Market, Chowk, Ring Road No. 1, near Pachpedi Naka, near Prakash swimming pool, Raipur, Chhattisgarh 492001",Raipur
Diamond Granites,09329563777,"6M93+7FW, Pachpedi Naka, New Dhamtari Rd, Raipur, Chhattisgarh 492001",Raipur
S.K.Stone | Best Stone Door Frame Dealer In Raipur | Stone Gate Frame Dealer In Raipur | Sand Stone Gate Frame Dealer,09424213340,"Ring Road No. 1, near Vardhman Cars, Bhatagaon, Raipur, Chhattisgarh 492013",Raipur
"Kohler Exclusive Showroom - Ace Granites, Raipur",07949291739,"Ramkrishna Care Hospital Road, near Aurobindo Eye Hospital, Bhairav society, Pachpedi Naka, Raipur, Tikrapara, Chhattisgarh 492001",Raipur
Vishwakarma Marble,09329071000,"Beside Sparsh Maruti Show Room, New Textile Market, Dhamtari Rd, Raipur, Chhattisgarh 492001",Raipur
Hindware Brand Store - Golden Marble,07714700522,"Marble Market, Ring Road No. 1, Marble Market, Durga Para, Santoshi Nagar, Raipur, Mathpurena, Chhattisgarh 492001",Raipur
"Shri Shankar Marble, Granite Center india",09981991331,"1, Telibandha Ring Rd, near Prakash Swimming Pool since 1989, Marble Market, Postal Colony, Santoshi Nagar, Raipur, Mathpurena, Chhattisgarh 492001",Raipur
"Venkatesh Marbles,Dhamtari Road",09669126000,"Plot No. 218-B, New Dhamtari Rd, Next To Colors Mall, Amrapali Society, Pachpedi Naka, Raipur, Tikrapara, Chhattisgarh 492001",Raipur
Aangan-Bariwal Tiles,09329690396,"Pachpedi Naka Rd, beside Rajdhani Hospital, Marble Market, Navjeevan Society, Pachpedi Naka, Raipur, Mathpurena, Chhattisgarh 492001",Raipur
VIP Super Fine Marble/Sanitation,07714020436,"Ring Road No. 1, Marble Market, Navjeevan Society, Santoshi Nagar, Raipur, Mathpurena, Chhattisgarh 492001",Raipur
Sandeep marble,09893605440,"Ring road no 1, pachpedi naka, chowk, Raipur, Chhattisgarh 492001",Raipur
Bhagwati Polygranite,09150007736,"Kushalpur Chowk, Ring Road 1, Satbahiniya Mandir, Road, New, Changurabhata, Chhattisgarh 492013",Raipur
Aishwarya Marble,09827163489,"Shop No: 1, 2, Prakash Swimming Pool, Marble Market, Ring Road No. 1, Santoshi Nagar, Raipur, Chhattisgarh 492001",Raipur
Arpita Marble & Tiles,08962626266,"Marble Market, Durga Para, Pachpedi Naka, Raipur, Mathpurena, Chhattisgarh 492001",Raipur
The House Of Tiles,08871309749,"ring road no. 1, chowk, Marble Market, Pachpedi Naka, Raipur, Chhattisgarh 492001",Raipur
Sanjay Distributors | Best Tiles Shop in Raipur | Best Mable Shop in Raipur,09425202040,"Opp. Rainbow TVS,, Deopuri Road,, Pachpedi Naka, Raipur, Chhattisgarh 492015",Raipur
The Tiles Spark RAIPUR,09109821337,"Kandul road, Old Dhamtari Rd, near anantra mart, Raipur, Chhattisgarh 492001",Raipur
Vishwakarma marble art,09329078100,"near Rathi Build Mart, Devpuri, Raipur, Chhattisgarh 492015",Raipur
Adarsh trading company,08103333390,"Shop no 10th shau complex Pachpedi Naka, chowk, Raipur, Chhattisgarh 492001",Raipur
RAMAA EXCLUSIVE TILES WORLD,09425595625,"chowk, Sanjay Nagar, Santoshi Nagar, Raipur, Mathpurena, Chhattisgarh 492001",Raipur
Ankit Stone Art,08827177704,"Ring Road No. 1, in front of water filter plant, Mathpurena, Ravanbhatha, Bhatagaon, Mathpurena, Raipur, Chhattisgarh 492013",Raipur
S S granite,07898507188,"S.s. granite dumartarai, Raipur, Chhattisgarh 492015",Raipur
"Kajaria Experience Centre - Tiles Showroom in Raipur, Chhattisgarh",09755007408,"Regional Office & Display Centre for Polished Vitrified Tiles Maharaja Plaza, 1st floor, Dhamtari Rd, near fruit market, Lalpur, Raipur, Chhattisgarh 492015",Raipur
FM marketing,09907043986,"213, Dhamtari Rd, near Colours Mall Shree Ganesha, Hospital Gali, Bajaj Colony, Pachpedi Naka, Raipur, Chhattisgarh 492001",Raipur
Seema Tiles & Granite,09303901818,"6J9X+94V, Laxmi Nagar, Navjeevan Society, Pachpedi Naka, Raipur, Mathpurena, Chhattisgarh 492001",Raipur
Makrana Marbles,09575469786,"Ring Road No. 1, Marble Market, Durga Para, Santoshi Nagar, Raipur, Mathpurena, Chhattisgarh 492001",Raipur
Swami (MG) Udhyog,07073735004,"Mana, Raipur, Chhattisgarh 492016",Raipur
INTERIOS modular kitchen,09131033787,"Raipur - Jagdalpur - Vishakhapatnam Rd, Nehru Nagar, Janta Colony, Raipur, Chhattisgarh 492001",Raipur
Lakshya Marketing,07415588393,"Behind Maharaja Plaza, near Alokik Dham, New Rajendra Nagar, Raipur, Chhattisgarh 492001",Raipur
Designo Plus,09302762789,"1st Floor, Ring Road No. 1, Marble Market, Postal Colony, Pachpedi Naka, Raipur, Mathpurena, Chhattisgarh 492001",Raipur
Mahamaya Tiles,09826146507,"6J9V+4HW, near by kamla women hospital, Marble Market, Postal Colony, Santoshi Nagar, Raipur, Mathpurena, Chhattisgarh 492001",Raipur
A. K tiles House,09303014388,"Colors mall, Dhamtari Rd, Pachpedi Naka, Raipur, Tikrapara, Chhattisgarh 492001",Raipur
Maa Jai Durga Tiles,09424233573,"1, Telibandha Ring Rd, Marble Market, chattisgarh nagar, Santoshi Nagar, Raipur, Mathpurena, Chhattisgarh 492001",Raipur
Kajaria Tiles Exclusive Showroom - Sanjay Distributors,09425202040,"Near Fruit Market, New Dhamtrai Road Lalpur, Pachpedi Naka, Raipur, Chhattisgarh 492015",Raipur
FM LUXURY,09907043986,"opposite Colors Mall, Pachpedi Naka, Raipur, Tikrapara, Chhattisgarh 492001",Raipur
New VK View Tiles,09826174843,"17, Ahead, Rajdhani Hospital, Laxmi Nagar, Navjeevan Society, Pachpedi Naka, Raipur, Mathpurena, Chhattisgarh 492001",Raipur
"GROHE - Milano Marketing I Bath & Sanitaryware, Shower, Faucets And Kitchen Mixer Taps",08046512208,"Dhamtari Rd, opposite Progressive Point, Lalpur, Raipur, Tikrapara, Chhattisgarh 492015",Raipur
Rajkamal Stone Tiles,08602416469,"Ring Road No. 1, Opp. Prakash Swimming Pool since 1989, Marble Market, Navjeevan Society, Pachpedinaka, Raipur, Mathpurena, Chhattisgarh 492001",Raipur
prajapati traders,09300360106,"Mahamai Para, Raipur, Chhattisgarh 492001",Raipur
Tisafur,09329127000,"near kamal Vihar main gate, Raipur, Devpuri, Chhattisgarh 492015",Raipur
Kajaria Tiles Authorised Showroom - Shree Jalaram Marketing,09425526888,"Shree Jalaram Marketing, New Dhamtari Rd, opposite Colors Mall, Raipur, Chhattisgarh 492001",Raipur
Kajaria Tiles Exclusive Showroom - V.I.P. Sanitations,09826166701,"p, pOpp. Prakash Sweeming Pool, Ring Road No. 1, Marble Market, p, Santoshi Nagar, Raipur, Chhattisgarh 492001",Raipur
RADHE TILES,08889466166,"Baraf factory Gali, Naharpara Road, New Dhamtari Rd, Pachpedi Naka, Raipur, Chhattisgarh 492001",Raipur
Chandra planet,08889700003,"Rooftop, Chandra Planet, Ring Road No. 1, above Spark Fitness Gym, Priyadarshini Nagar Colony, Gurumukh Singh Nagar, Raipur, Tikrapara, Chhattisgarh 492001",Raipur
Prime Tiles and sanitary,09302558000,"Devpuri Rd, Raipur, Tikrapara, Chhattisgarh 492015",Raipur
Shree Laxmi Marble,09893065553,"7J7P+CX2, Fafadih Rd, R.V.H. Colony, Jagriti Nagar, Fafadih, Raipur, Chhattisgarh 492009",Raipur
"H & R Johnson Tiles - Tile Studio - Best Tiles for Bathroom, Kitchen, Wall & Floor in Raipur",08037762896,"Shop No 1, Amlidh Crossing, New Dhamtari Road Devpuri, opposite Sai Motors, Raipur, Chhattisgarh 492015",Raipur
AAKRITI,06266919265,"Aakriti Towers, NH3, Pachpedi Naka, Raipur, Chhattisgarh 492001",Raipur
GOPAL CERAMICS,09329340136,"mishra bada, Ring Road No. 1, Marble Market, Durga Para, Santoshi Nagar, Raipur, Mathpurena, Chhattisgarh 492001",Raipur
Kajaria Tiles Authorised Showroom - Sundeep Trading Co.,08878888777,"Radha Mohan Complex, Near, Tower, Agrasen Marg, Bhaisthan, Road, Raipur, Chhattisgarh 492001",Raipur
Ram Krishna Nursery,09575111333,"Mathpara Road, Mahamai Para, Raipur, Chhattisgarh 492001",Raipur
Basant Marbles,09826815657,"Basant Marbles, beside Maharaja Plaza, RishabhNagar and Pawan Vihar Colony, Lalpur, Raipur, Tikrapara, Chhattisgarh 492015",Raipur
Birla Pivot Tiles & Bathware - Indian Pipe House,09098011685,"Ground Floor, near Ashok Mart, Janta Colony, Gokul Nagar, Moudhapara, Raipur, Gudhiyari, Chhattisgarh 492001",Raipur
Panchmukhi tiles and sanitary Raipur,09981664475,"Gali No 1, chowk, in front of Trrafic Thana, Transport Nagar, Tatibandh, Raipur, Chandanidih, Chhattisgarh 492099",Raipur
MONALISA FOUNTAINS,09827117202,"Sona Tower, 6, Deshbandhu Press Rd, near Agrasen Chowk, Nagar Nigam Colony, Jawahar Nagar, Raipur, Chhattisgarh 492001",Raipur
Shagun Tiles & Senetary,07224919988,"rode Durga mandir, Purana dhamtari, ke Pass, Raipur, Chhattisgarh 492001",Raipur
Kajaria Tiles Exclusive Showroom - VIP Sanitation,09826166701,"VIP Sanitation, Marble Market, Ring Road No. 1, Marble Market, Postal Colony, Santoshi Nagar, Raipur, Mathpurena, Chhattisgarh 492001",Raipur
"Simpolo Tiles & Bathware - Devpuri, Raipur",08037014189,"Uniiversal Plus, New Dhamtari Rd, nearby Kamal Vihar Gate, Devpuri, Raipur, Chhattisgarh 492015",Raipur
Shree Vijay Laxmi Marble,09826141127,"Vidhan Sabha Rd, Mowa, Raipur, Chhattisgarh 492014",Raipur
"Arihant C Mart - Granite, Tiles & Interior Design Showroom Raipur",09617718000,"Shanti Sarovar - Ground, Vidhan Sabha Rd, beside gate of Brahmkumari, opp. Hotel Royal Castle, Saddu, Raipur, Chhattisgarh 492001",Raipur
Sonam sales,09174030610,"Sonam Sales, Lalpur, Devpuri, Raipur, Chhattisgarh 492015",Raipur
K Manilal and Company,09406200872,"Shri Patidar Bhawan, Near, Raipur Rd, Bhanpuri, Raipur, Chhattisgarh 492008",Raipur
Aarya Tiles and Sanitary,08889083944,"Infront Of Shrishti Vihar Colony, Hirapur Rd, Kabir Nagar, Raipur, Chhattisgarh 492099",Raipur
NAVKAR ASSOCIATES,07714085002,"6MC6+RQ6, New Rajendra Nagar, Raipur, Tikrapara, Chhattisgarh 492001",Raipur
Maruti Granites,09425887150,"4Q33+5J2, Raipur - Abhanpur Rd, Sector 40, Uparwara, Chhattisgarh 493661",Raipur
Amba Traders,09907127046,"6J9V+7V3, Beside Granite Center, Marble Market, Postal Colony, Pachpedi Naka, Raipur, Mathpurena, Chhattisgarh 492001",Raipur
Pavitra Granite & Marble,08817599738,"New Dhamtari Rd, near HP petrol pump, Lalpur, Raipur, Tikrapara, Chhattisgarh 492001",Raipur
